design The design The design The design The design The design The design The design The design The design The design The design The design The design The design The,design design The design The design The design The design The design The design The design The design The design The design The design The design The design The design,design The design The design design The design The design The design The design The design The design The design The design The design The design The design The design,design The design The design The design design The design The design The design The design The design The design The design The design The design The design The design,within design The design The design The design The design The design The design The design The design The design The design The design The design The design The design
The to. The to. The to. The to. The to. The to. The to. The to. The to. The to.,The to. The to. The to. The to. The to. The to. The to. The to. The to. The to the,The to. The to. The to. The to. The to. The to. The to. The to. The to the. The to,The to. The to. The to. The to. The to. The to. The to. The to the. The to. The to,The to. The to. The to. The to. The to. The to. The to the. The to. The to. The to
space and space and space and space and space and space and space and space and space and space and space and space and space and space and space and,space space and space and space and space and space and space and space and space and space and space and space and space and space and space and space,occupied space and space and space and space and space and space and space and space and space and space and space and space and space and space and space,s space and space and space and space and space and space and space and space and space and space and space and space and space and space and space,y space and space and space and space and space and space and space and space and space and space and space and space and space and space and space
I I I I I I I I I I I I I I I I I I I I I I I I I I I I I I,I I I I I I I I I I I I I I I I I I I I I I I I I I I I I was,I I I I I I I I I I I I I I I I I I I I I I I I I I I I I It,I I I I It I I I I I I I I I I I I I I I I I I I I I I I I I,I I I I I I I I I I I I I I I I I I I I I I I I I I I I It was
closed after it closed after it closed after it closed after it closed after it closed after it closed after it closed after it closed after it closed after it,after it closed after it closed after it closed after it closed after it closed after it closed after it closed after it closed after it closed after it closed,after after it closed after it closed after it closed after it closed after it closed after it closed after it closed after it closed after it closed after it,its after it closed after it closed after it closed after it closed after it closed after it closed after it closed after it closed after it closed after it,it after it closed after it closed after it closed after it closed after it closed after it closed after it closed after it closed after it closed after it
send it and send it and send it and send it and send it and send it and send it and send it and send it and send it and,send it and send it and send it it and send it and send it and send it and send it and send it and send it and send it,send it and send it and send it and send it it and send it and send it and send it and send it and send it and send it,send it and send it and send it and send it and send it and it and send it and send it and send it and send it and send,send it and send it and send it and send it and send it and send it and it and send it and send it and send it and send
He knows it. He knows it. He knows it. He knows it. He knows it. He knows it. He knows it. He knows,asks it. He knows it. He knows it. He knows it. He knows it. He knows it. He knows it. He knows it,.. He who knows it. He who knows it. He who knows it. He who knows it. He who knows it. He who knows,it. He knows it. He knows it. He knows it. He knows it. He knows it. He knows it. He knows it.,it it. He knows it. He knows it. He knows it. He knows it. He knows it. He knows it. He knows it
One One One One One One One One One One One One One One One One One One One One One One One One One One One One One One,One One One One One One. One One One One One One One One One One One One One One One One One One One One One One One,One One One One One. One One One One One One One One One One One One One One One One One One One One One One One One,One One One One. One One One One One One One One One One One One One One One One One One One One One One One One One,love the love the love the love the love the love the love the love the love the love the love the love the love the love the love the
icles The poems The poems The poems The poems The poems The poems The poems The poems The poems The poems The poems The poems The poems The poems The,icles The poems The poems The poems The poems The poems The poems The poems The poems The poems The poems The poems The poems The poems The poems ,icles The eight poems The eight poems The eight poems The eight poems The eight poems The eight poems The eight poems The eight poems The eight poems The eight,icles The eight poems The eight poems The poems The eight poems The eight poems The eight poems The eight poems The eight poems The eight poems The eight poems,icles The eight poems The eight poems The eight poems The poems The eight poems The eight poems The eight poems The eight poems The eight poems The eight poems
daughter daughter born daughter born daughter born daughter born daughter born daughter born daughter born daughter born daughter born daughter born daughter born daughter born daughter born daughter born daughter,daughter Their daughter Their daughter Their daughter Their daughter Their daughter Their daughter Their daughter Their daughter Their daughter Their daughter Their daughter Their daughter Their daughter Their daughter Their,daughter daughter born daughter born daughter born born daughter born daughter born daughter born daughter born daughter born daughter born daughter born daughter born daughter born daughter born daughter born,daughter daughter born daughter born daughter born daughter born born daughter born daughter born daughter born daughter born daughter born daughter born daughter born daughter born daughter born daughter born,Their daughter born daughter born daughter born daughter born daughter born daughter born daughter born daughter born daughter born daughter born daughter born daughter born daughter born daughter born daughter
Hey on and on and on and on and on and on and on and on and on and on and on and on and on and on and on,Ray and Ray and Ray and Ray and Ray and Ray and Ray and Ray and Ray and Ray and Ray and Ray and Ray and Ray and Ray and,Hey and on and on and on and on and on and on and on and on and on and on and on and on and on and on and,Hey and Ray and Ray and Ray and Ray and Ray and Ray and Ray and Ray and Ray and Ray and Ray and Ray and Ray and Ray and,Hi and on and on and on and on and on and on and on and on and on and on and on and on and on and on and
color the color the color the color the color the color the color the color the color the color the color the color the color the color the color the,color the color color the color the color the color the color the color the color the color the color the color the color the color the color the color,color the orange color the orange color the orange color the orange color the orange color the orange color the orange color the orange color the orange color the orange,color the color the color color the color the color the color the color the color the color the color the color the color the color the color the color,color the color the color the the color the color the color the color the color the color the color the color the color the color the color the color
atatatatatatatatatatatatatatatatatatatatatatatatatatatatatat,52 52 52 52 52 52 52 52 52 52 52 52 52 52 52 52 52 52 52 52 52 52 52 52 52 52 52 52 52 52,He He He He He He He He He He He He He He He He He He He He He He He He He He He He He He,76atatatatatatatatatatatatatatatatatatatatatatatatatatatatat,canceratatatatatatatatatatatatatatatatatatatatatatatatatatatatat
O O O O O O O O O O O O O O O O O O O O O O O O O O O O O O,education from education from education from education from education from education from education from education from education from education from education from education from education from education from education from,education from education from education from education education from education from education from education from education from education from education from education from education from education from education from education,education from education from education from education from education education from education from education from education from education from education from education from education from education from education from education,education from education from education from education from education from education education from education from education from education from education from education from education from education from education from education
food of food and food of food of food of food of food of food of food of food of food of food of food of food of food of,food of food and food of food and food of food and food of food and food of food and food of food and food of food and food of,food of food and of food and of food and of food and of food and of food and of food and of food and of food and of food,food of food and of food of food of food of food of food of food of food of food of food of food of food of food of food,food of food and food of food of food and food of food of food of food of food of food of food of food of food of food of
pulmonary pulmonary pulmonary pulmonary pulmonary pulmonary pulmonary pulmonary pulmonary pulmonary pulmonary pulmonary pulmonary pulmonary pulmonary pulmonary pulmonary pulmonary pulmonary pulmonary pulmonary pulmonary pulmonary pulmonary pulmonary pulmonary pulmonary pulmonary,Brisbane and Brisbane and Brisbane and Brisbane and Brisbane and Brisbane and Brisbane and Brisbane and Brisbane and Brisbane and Brisbane and Brisbane and Brisbane and Brisbane and,pulmonary and pulmonary pulmonary pulmonary pulmonary pulmonary pulmonary pulmonary pulmonary pulmonary pulmonary pulmonary pulmonary pulmonary pulmonary pulmonary pulmonary pulmonary pulmonary pulmonary pulmonary pulmonary pulmonary pulmonary pulmonary pulmonary pulmonary,severe and severe and severe as severe as severe as severe as severe as severe as severe as severe as severe as severe as severe as severe as severe as,pulmonary pulmonary pulmonary pulmonary pulmonary pulmonary pulmonary pulmonary pulmonary pulmonary pulmonary pulmonary pulmonary pulmonary pulmonary pulmonary pulmonary pulmonary pulmonary pulmonary pulmonary pulmonary pulmonary pulmonary pulmonary pulmonary pulmonary and
every in a building in a building in a building in a building in a building in a building in a building in a building in a building in a,every of a building in a building in a building in a building in a building in a building in a building in a building in a building in a,every in a building in a building in a building in a building in a building in a building in a building in a building in a building in building,every in a building in a building in a building in a building in a building in a building in a building in a building in building in a building,every in a building in a building in a building in a building in a building in a building in a building in building in a building in a building
I I I I I I I I I I I I I I I I I I I I I I I I I I I I I I,true I. I. I. I. I. I. I. I. I. I. I. I. I. I. I,. I. I. I. I. I. I. I. I. I. I. I. I. I. I. I,I I I I I I I I I I I I I I I I I I I I I I I I I I I I I.,history I. I. I. I. I. I. I. I. I. I. I. I. I. I. I
10 10 10 10 10 10 10 10 10 10 10 10 10 10 10 10 10 10 10 10 10 10 10 10 10 10 10 10 10 10,10 10 10 10 10 10 10 10 10 10 10 10 10 10 10 10 10 10 10 10 10 10 10 10 10 10 10 10 10 August,10 10 10 10 10 10 10 10 10 10 10 10 10 10 10 10 10 10 10 10 10 10 10 10 10 10 10 10 10 into,10 10 10 10 10 10 10 10 10 10 10 10 10 10 10 10 10 10 10 10 10 10 10 10 10 10 10 10 10 29,10 10 10 10 10 10 10 10 10 10 10 10 10 10 10 10 10 10 10 10 10 10 10 10 10 10 10 10 10 April
stage and stage and stage and stage and stage and stage and stage and stage and stage and stage and stage and stage and stage and stage and stage and,The stage and stage and stage and stage and stage and stage and stage and stage and stage and stage and stage and stage and stage and stage and stage,and officers and officers and officers and officers and officers and officers and officers and officers and officers and officers and officers and officers and officers and officers and officers,while officers and officers and officers and officers and officers and officers and officers and officers and officers and officers and officers and officers and officers and officers and officers,The officers and officers and officers and officers and officers and officers and officers and officers and officers and officers and officers and officers and officers and officers and officers
film the film the film the film the film the film the film the film the film the film the film the film the film the film the film the,went the film went the film went the film went the film went the film went the film went the film went the film went the film went the film,do do it the rio do it the rio do it the rio do it the rio do it the rio do it the r,do do it the rio do it rio do it rio do it rio do it rio do it rio do it rio,do do it the rio do it do it do it do it do it do it do it do it do it do it do it do it
I I. I. I. I. I. I. I. I. I. I. I. I. I. I. I,. I. I. I. I. I. I. I. I. I. I. I. I. I. I. I,I. I. I. I. I. I. I. I. I. I. I. I. I. I. I.,.. Lea Lea Lea Lea Lea Lea Lea Lea Lea Lea Lea Lea Lea Lea,"I, I. I. I. I. I. I. I. I. I. I. I. I. I. I."
l. l. l. l. l. l. l. l. l. l. l. l. l. l. l.,star and the star and the star and the star and the star and the star and the star and the star and the star and the star and the,Space and Space and Space and Space and Space and Space and Space and Space and Space and Space and Space and Space and Space and Space and Space and,My the star and the star and the star and the star and the star and the star and the star and the star and the star and the star,star and the star and star and the star and the star and the star and the star and the star and the star and the star and the star
range of birds in range of birds in range of birds in range of birds in range of birds in range of birds in range of birds in range of,attacks or attacks by birds or by birds or by birds or by birds or by birds or by birds or by birds or by birds or by birds or,attacks or attacks by birds or by birds or birds or by birds or by birds or by birds or by birds or by birds or by birds or by,attacks or attacks by birds or by birds or by birds or birds or by birds or by birds or by birds or by birds or by birds or by,attacks or attacks by birds in which it attacks birds in which it attacks birds in which it attacks birds in which it attacks birds in which it attacks birds
I I I I I I I I I I I I I I I I I I I I I I I I I I I I I I,I I I I I I I I I I I I I I I I I I I I I I I I I I I I I for,I I I I I I I I I I I I I I I I I I I I I I I I I I I I I left,I I I I I I I I I I I I I I I I I I I I I I I I I I I I I What,I I I I I I I I I I I I I I I I I I I I I I I I I I I I I September
transfer and transfer to the transfer and transfer to transfer to transfer to transfer to transfer to transfer to transfer to transfer to transfer to transfer to transfer to transfer,transfer to the transfer to the transfer to the transfer to the transfer to the transfer to the transfer to the transfer to the transfer to the transfer to the,transfer and transfer to the transfer and transfer to the transfer and transfer to the transfer and transfer to the transfer and transfer to the transfer and transfer to the,transfer and the transfer to the transfer to the transfer to the transfer to the transfer to the transfer to the transfer to the transfer to the transfer to the,Ark and the Ark and the Ark and the Ark and the Ark and the Ark and the Ark and the Ark and the Ark and the Ark and the
29 on June 1 and on June 1 and on June 1 and on June 1 and on June 1 and on June 1 and on June 1 and on,1 on June 1 and on June 1 and on June 1 and on June 1 and on June 1 and on June 1 and on June 1 and on,1972 on June 1 and on June 1 and on June 1 and on June 1 and on June 1 and on June 1 and on June 1 and on,ance on June 1 and on June 1 and on June 1 and on June 1 and on June 1 and on June 1 and on June 1 and on,on on June 1 and on June 1 and on June 1 and on June 1 and on June 1 and on June 1 and on June 1 and on
Do on and on and on and on and on and on and on and on and on and on and on and on and on and on and on,Do and on and on and on and on and on and on and on and on and on and on and on and on and on and on and,and on and on and on and on and on and on and on and on and on and on and on and on and on and on and on,Do on and on and on and on and on and on and on and on and on and on and on and on and on and on on and,Do on and on and on and on and on and on and on and on and on and on and on and on and on on and on and
I I I I I I I I I I I I I I I I I I I I I I I I I I I I I I,I I. I. I. I. I. I. I. I. I. I. I. I. I. I. I,19 I. I. I. I. I. I. I. I. I. I. I. I. I. I. I,. I. I. I. I. I. I. I. I. I. I. I. I. I. I. I,I. I. I. I. I. I. I. I. I. I. I. I. I. I. I.
I I and I and I and I and I and I and I and I and I and I and I and I and I and I and I,I and I and I and I and I and I and I and I and I and I and I and I and I and I and I and,and I and I and I and I and I and I and I and I and I and I and I and I and I and I and I,October and October and October and October and October and October and October and October and October and October and October and October and October and October and October and,I was and I was and I was and I was and I was and I was and I was and I was and I was and I was and
I and I and I and I and I and I and I and I and I and I and I and I and I and I and I and,Virginia of Virginia and Virginia and Virginia and Virginia and Virginia and Virginia and Virginia and Virginia and Virginia and Virginia and Virginia and Virginia and Virginia and Virginia and,were I and I and I and I and I and I and I and I and I and I and I and I and I and I and I,of I and I and I and I and I and I and I and I and I and I and I and I and I and I and I,"I, I and I and I and I and I and I and I and I and I and I and I and I and I and I and"
number in the year and the number in the year and the number in the year and the number in the year and the number in the year and the,next in the year and the next in the year and the next in the year and the next in the year and the next in the year and the,before in the year and the next in the year and the next in the year and the next in the year and the next in the year and the,number in the year and the number in the year and the number in the year and the year and the number in the year and the number in the,number in the year and the number in the year and the number in the year and the number in the year and the year and the number in the
like I. I. I. I. I. I. I. I. I. I. I. I. I. I. I,. I. I. I. I. I. I. I. I. I. I. I. I. I. I. I,I. I. I. I. I. I. I. I. I. I. I. I. I. I. I.,on I. I. I. I. I. I. I. I. I. I. I. I. I. I. I,like I. I. I. I. I. I. I. I. I I. I. I. I. I. I.
Yes of the range of the range of the range of the range of the range of the range of the range of the range of the range of the,the range of the range of the range of the range of the range of the range of the range of the range of the range of the range of,western of the western range of the western range of the western range of the western range of the western range of the western range of the western range of,range of the western range of the western range of the western range of the western range of the western range of the western range of the western range of,range of the range of the range of the range of the range of the range of the range of the range of the range of the range of the
ne ne ne ne ne ne ne ne ne ne ne ne ne ne ne ne ne ne ne ne ne ne ne ne ne ne ne ne ne ne,ne ne ne ne ne ne ne ne ne ne ne ne ne ne ne ne ne ne ne ne ne ne ne ne ne ne ne ne ne r,ne ne ne ne ne ne ne ne ne ne ne ne ne ne ne ne ne ne ne ne ne ne ne ne ne ne ne ne ne from,ne ne ne ne ne ne ne ne ne ne ne ne ne ne ne ne ne ne ne ne ne ne ne ne ne ne ne ne ne ph,ne ne ne ne ne ne ne ne ne ne ne ne ne ne ne ne ne ne ne ne ne ne ne ne ne ne ne ne ne were
Okay in stone in stone in stone in stone in stone in stone in stone in stone in stone in stone in stone in stone in stone in stone in,grey in light grey in light grey in light grey in light grey in light grey in light grey in light grey in light grey in light grey in light,stone in stone in stone in stone in stone in stone in stone in stone in stone in stone in stone in stone in stone in stone in stone in,in in stone in stone in stone in stone in stone in stone in stone in stone in stone in stone in stone in stone in stone in stone in,light in stone in stone in stone in stone in stone in stone in stone in stone in stone in stone in stone in stone in stone in stone in
Hill The Hill The Hill The Hill The Hill The Hill The Hill The Hill The Hill The Hill The Hill The Hill The Hill The Hill The Hill The,provided. provided. provided. provided. provided. provided. provided. provided. provided. provided. provided. provided. provided. provided. provided.,Hill an an an an an an an an an an an an an an an an an an an an an an an an an an an an an,Hill The Hill The Hill The Hill Hill The Hill The Hill The Hill The Hill The Hill The Hill The Hill The Hill The Hill The Hill The Hill,Hill The Hill The Hill The Hill The Hill Hill The Hill The Hill The Hill The Hill The Hill The Hill The Hill The Hill The Hill The Hill
Japanese and Japanese and Japanese and Japanese and Japanese and Japanese and Japanese and Japanese and Japanese and Japanese and Japanese and Japanese and Japanese and Japanese and Japanese and,I I and I and I and I and I and I and I and I and I and I and I and I and I and I and I,I and I and I and I and I and I and I and I and I and I and I and I and I and I and I and,and I and I and I and I and I and I and I and I and I and I and I and I and I and I and I,oil and oil and oil and oil and oil and oil and oil and oil and oil and oil and oil and oil and oil and oil and oil and
. I. I. I. I. I. I. I. I. I. I. I. I. I. I. I,I. I. I. I. I. I. I. I. I. I. I. I. I. I. I.,"I, I. I. I. I. I. I. I. I. I. I. I. I. I. I.",I. I. I. I. I. I. I. I I. I. I. I. I. I. I. I,I. I. I. I. I. I. I. I. I I. I. I. I. I. I. I
screen and a screen behind a screen behind a screen behind a screen behind a screen behind a screen behind a screen behind a screen behind a screen behind a,them and a whale and a whale and a whale and a whale and a whale and a whale and a whale and a whale and a whale and a,out in a rain out in a rain out in a rain out in a rain out in a rain out in a rain out in a rain out in,before and behind a screen behind a screen behind a screen behind a screen behind a screen behind a screen behind a screen behind a screen behind a screen behind,bows and a shark and a shark and a shark and a shark and a shark and a shark and a shark and a shark and a shark and a
It and it and it and it and it and it and it and it and it and it and it and it and it and it and it and,and it and it and it and it and it and it and it and it and it and it and it and it and it and it and it,The. and The. and The. and The. and The. and The. and The. and The. and The. and The. and,about about it and about it and about it and about it and about it and about it and about it and about it and about it and about it,It. and It. and It. and It. and It. and It. and It. and It. and It. and It. and
ang the rains from the rains from the rains from the rains from the rains from the rains from the rains from the rains from the rains from the rains,their the rains from the rains from the rains from the rains from the rains from the rains from the rains from the rains from the rains from the rains,a the rains from the rains from the rains from the rains from the rains from the rains from the rains from the rains from the rains from the rains,from the rains from the rains from the rains from the rains from the rains from the rains from the rains from the rains from the rains from the rains,That the rains from the rains from the rains from the rains from the rains from the rains from the rains from the rains from the rains from the rains
