four's fours fours fours fours fours fours fours fours fours fours fours fours fours four,four's fours fours fours fours fours fours fours fours fours fours fours fours fours ',four's fours fours fours fours fours fours fours fours fours fours's fours fours four,team's team's team team's team's team's team's team's team's team's team ',Are team's team's team's team's team's team's team's team's team's team '
released. released. released. released. released. released. released. released. released. released. released. released. released. released. released.,2004. released. released. released. released. released. released. released. released. released. released. released. released. released. released.,Hi Hi. Hi. Hi. Hi. Hi. Hi. Hi. Hi. Hi. Hi. Hi. Hi. Hi. Hi. Hi,2004. 2004. 2004. 2004. 2004. 2004. 2004. 2004. 2004. 2004. 2004. 2004. 2004. 2004. 2004.,2004. released 2004. released 2004. released 2004. released 2004. released 2004. released 2004. released 2004. released 2004. released 2004. released
Nothing. Nothing. Nothing. Nothing. Nothing. Nothing. Nothing. Nothing. Nothing. Nothing. Nothing. Nothing. Nothing. Nothing. Nothing.,Nothing. Nothing. Nothing. Nothing. Nothing. Nothing. Nothing Nothing. Nothing. Nothing. Nothing. Nothing. Nothing. Nothing. Nothing. Nothing,Nothing. Nothing. Nothing. Nothing. Nothing Nothing. Nothing. Nothing. Nothing. Nothing. Nothing. Nothing. Nothing. Nothing. Nothing. Nothing,Nothing. Nothing. Nothing. Nothing. Nothing. Nothing. Nothing. Nothing. Nothing Nothing. Nothing. Nothing. Nothing. Nothing. Nothing. Nothing,Nothing. Nothing. Nothing. Nothing. Nothing. Nothing. Nothing. Nothing. Nothing. Nothing Nothing. Nothing. Nothing. Nothing. Nothing. Nothing
after by public protest after public protest after public protest after public protest after public protest after public protest after public protest after public protest after public protest after public,Theininin Theinin Thein Thein Thein Thein Thein Thein Thein Thein Thein Thein Thein The,Theininin Theininin Theininin Theininin Theininin Theininin Theininin Thein,Theininin Theinin Theinin Thein Thein Thein Thein Thein Thein Thein Thein Thein Thein,Theininin Theininin Theininin Theininin Theininin Theininin Theinininin The
RE the sea to the sea to the sea to the sea to the sea to the sea to the sea to the sea to the sea to the sea,sea to the sea to the sea to the sea to the sea to the sea to the sea to the sea to the sea to the sea to the,the to the sea to the sea to the sea to the sea to the sea to the sea to the sea to the sea to the sea to the,to the sea to the sea to the sea to the sea to the sea to the sea to the sea to the sea to the sea to the sea,O to the sea to the sea to the sea to the sea to the sea to the sea to the sea to the sea to the sea to the
additional bridges that connect bridges that connect bridges that connect bridges that connect bridges that connect bridges that connect bridges that connect bridges that connect bridges that connect bridges,name have been his name that have been his name that have been his name that have been his name that have been his name that have been his name,since have been his name that have been his name that have been his name that have been his name that have been his name that have been his name,anned have been his name that have been his name that have been his name that have been his name that have been his name that have been his name,that have since been his name that have been his name that have been his name that have been his name that have been his name that have been his
hospital in the hospital in the hospital in the hospital in the hospital in the hospital in the hospital in the hospital in the hospital in the hospital in the,was in the hospital in the hospital in the hospital in the hospital in the hospital in the hospital in the hospital in the hospital in the hospital in the,hospital at the hospital in the hospital in the hospital in the hospital in the hospital in the hospital in the hospital in the hospital in the hospital in the,was at the hospital in the hospital in the hospital in the hospital in the hospital in the hospital in the hospital in the hospital in the hospital in the,the at the hospital in the hospital in the hospital in the hospital in the hospital in the hospital in the hospital in the hospital in the hospital in the
bag and the bag and the bag and the bag and the bag and the bag and the bag and the bag and the bag and the bag and the,bag bag and the bag and the bag and the bag and the bag and the bag and the bag and the bag and the bag and the bag and,bag the bag and the bag and the bag and the bag and the bag and the bag and the bag and the bag and the bag and the bag,and and the bag and the bag and the bag and the bag and the bag and the bag and the bag and the bag and the bag and the,bag and the bag and the bag and the bag and the bag and the bag and the bag and bag and the bag and the bag and the bag
