said but it is said it is said it is said it is said it is said it is said it is said it is said it is said it,but but it is said it is said it is said it is said it is said it is said it is said it is said it is said it,", but it is said it is said it is said it is said it is said it is said it is said it is said it is said it",she it is said she is said she is said she is said she is said she is said she is said she is said she is said she is,. but it is said it is said it is said it is said it is said it is said it is said it is said it is said it
books and books and books and books and books and books and books and books and books and books and books and books and books and books and books and,rights rights and rights and rights and rights and rights and rights and rights and rights and rights and rights and rights and rights and rights and rights and rights,music and music. and music. and music. and music. and music. and music. and music. and music. and music. and music,rights and rights and rights and rights and rights and rights and rights and rights and rights and rights and rights and rights and rights and rights and rights and,books and books on books and books on books and books on books and books on books and books on books and books on books and books on books and
", and the directors and the directors and the directors and the directors and the directors and the directors and the directors and the directors and the directors and the",directors and directors and directors and directors and directors and directors and directors and directors and directors and directors and directors and directors and directors and directors and directors,and and the directors and the directors and the directors and the directors and the directors and the directors and the directors and the directors and the directors and the,", and the directors and the directors and the directors and the directors and the directors and the directors and directors and the directors and the directors and the directors",", and the directors and the directors and the directors and the directors and the directors and directors and the directors and the directors and the directors and the directors"
u. s. s. s. s. s. s. s. s. s. s. s. s. s. s.,news in the news in the news in the news in the news in the news in the news in the news in the news in the news in the,the news in the news in the news in the news in the news in the news in the news in the news in the news in the news in,u. s. s. s. s. s. s. s. s. s. s. s. s. s. s s,u. s. s. s. s. s. s. s. s. s. s. s. s. s s. s
the in the action in the action in the action in the action in the action in the action in the action in the action in the action in the,on in the action in the action in the action in the action in the action in the action in the action in the action in the action in the,in in the action in the action in the action in the action in the action in the action in the action in the action in the action in the,an in the action in the action in the action in the action in the action in the action in the action in the action in the action in the,the in the action to the action to the action to the action to the action to the action to the action to the action to the action to the
.. I. I. I. I. I. I. I. I. I. I. I. I. I. I.,I I. I. I. I. I. I. I. I. I. I. I. I. I. I. I,"h, h. h. h. h. h. h. h. h. h. h. h. h. h. h.",",. h. h. h. h. h. h. h. h. h. h. h. h. h. h.",. I. I. I. I. I. I. I. I. I. I. I. I. I. I. I
1 1 1 1 1 1 1 1 1 1 1 1 1 1 1 1 1 1 1 1 1 1 1 1 1 1 1 1 1 1,1 1 1 1 1 1 1 1 1 1 1 1 1 1 1 1 1 1 1 1 1 1 1 1 1 1 1 1 1.,1 1 1 1 1 1 1 1 1 1 1 1 1 1 1 1 1 1 1 1 1 1 1 1 1 1 1 1 1 the,Computer in the Computer in the Computer in the Computer in the Computer in the Computer in the Computer in the Computer in the Computer in the Computer in the,1 1 1 1 1 1 1 1 1 1 1 1 1 1 1 1 1 1 1 1 1 1 1 1 1 1 1 1 1 in
1 1 1 1 1 1 1 1 1 1 1 1 1 1 1 1 1 1 1 1 1 1 1 1 1 1 1 1 1 1,5 1 1 1 1 1 1 1 1 1 1 1 1 1 1 1 1 1 1 1 1 1 1 1 1 1 1 1 1 1,34 & 1 & 1 & 1 & 1 & 1 & 1 & 1 & 1 & 1 & 1 & 1 & 1 & 1 & 1 &,1 & 1 & 1 & 1 & 1 & 1 & 1 & 1 & 1 & 1 & 1 & 1 & 1 & 1 & 1 &,5 & 1 & 1 & 1 & 1 & 1 & 1 & 1 & 1 & 1 & 1 & 1 & 1 & 1 & 1 &
back to back to back to back to back to back to back to back to back to back to back to back to back to back to back to,back back to back to back to back to back to back to back to back to back to back to back to back to back to back to back,approved to be approved to be approved to be approved to be approved to be approved to be approved to be approved to be approved to be approved to be,economic back to the economic back to the economic back to the economic back to the economic back to the economic back to the economic back to the economic back,back to back to back to back to back back to back to back to back to back to back to back to back to back to back to back
economy of economy of economy of economy of economy of economy of economy of economy of economy of economy of economy of economy of economy of economy of economy,year of year of year of year of year of year of year of year of year of year of year of year of year of year of year of,economy of year of year of year of year of year of year of year of year of year of year of year of year of year of year,representatives of representatives of representatives of representatives of representatives of representatives of representatives of representatives of representatives of representatives of representatives of representatives of representatives of representatives of representatives,economy of economy of economy of economy economy of economy of economy of economy of economy of economy of economy of economy of economy of economy of economy of
disappointing the results from the results from the results from the results from the results from the results from the results from the results from the results,east to the east to the east to the east to the east to the east to the east to the east to the east to the east to the,from to the east to the east to the east to the east to the east to the east to the east to the east to the east to the,small to the east to the east to the east to the east to the east to the east to the east to the east to the east to the,. from the east to the east to the east to the east to the east to the east to the east to the east to the east to the
industrial to industrial to industrial to industrial to industrial to industrial to industrial to industrial to industrial to industrial to industrial to industrial to industrial to industrial to industrial to,down is down to down to down to down to down to down to down to down to down to down to down to down to down to down to,industrial to industrial to industrial industrial to industrial to industrial to industrial to industrial to industrial to industrial to industrial to industrial to industrial to industrial to industrial to industrial,industrial to industrial to industrial to industrial industrial to industrial to industrial to industrial to industrial to industrial to industrial to industrial to industrial to industrial to industrial to industrial,industrial to industrial to industrial to industrial to industrial industrial to industrial to industrial to industrial to industrial to industrial to industrial to industrial to industrial to industrial to industrial
t. t. t. t. t. t. t. t. t. t. t. t. t. t. t.,to. t. t. t. t. t. t. t. t. t. t. t. t. t. t.,t. t. t. t. t. t. t. t. t. t. t. t. t. t t. t,t. t. t. t. t. t. t. t. t. t. t t. t. t. t. t,t. t. t. t. t. t. t. t. t. t. t. t t. t. t. t
I I. I. I. I. I. I. I. I. I. I. I. I. I. I. I,16 I. I. I. I. I. I. I. I. I. I. I. I. I. I. I,. I. I. I. I. I. I. I. I. I. I. I. I. I. I. I,I. I. I. I. I. I. I. I. I. I. I. I. I. I. I.,now I. I. I. I. I. I. I. I. I. I. I. I. I. I. I
wow wow wow wow wow wow wow wow wow wow wow wow wow wow wow wow wow wow wow wow wow wow wow wow wow wow wow wow wow wow,1 per cent per cent per cent per cent per cent per cent per cent per cent per cent per cent per cent per cent per cent per cent per,cent per cent per cent per cent per cent per cent per cent per cent per cent per cent per cent per cent per cent per cent per cent per,cent per cent per per cent per cent per cent per cent per cent per cent per cent per cent per cent per cent per cent per cent per cent,1 per cent per per cent per cent per cent per cent per cent per cent per cent per cent per cent per cent per cent per cent per cent
"I, I. I. I. I. I. I. I. I. I. I. I. I. I. I.",worst in the worst in the worst in the worst in the worst in the worst in the worst in the worst in the worst in the worst in the,"I, I. I. I. I. I. I. I. I I. I. I. I. I. I. I",I in the I. I. I. I. I. I. I. I. I. I. I. I. I. I,"I, I. I. I. I. I. I. I I. I. I. I. I. I. I. I"
analysts and analysts and analysts and analysts and analysts and analysts and analysts and analysts and analysts and analysts and analysts and analysts and analysts and analysts and analysts,analysts and analysts and analysts and and analysts and analysts and analysts and analysts and analysts and analysts and analysts and analysts and analysts and analysts and analysts and,accounting and accounting and accounting and accounting and accounting and accounting and accounting and accounting and accounting and accounting and accounting and accounting and accounting and accounting and accounting,analysts and analysts and analysts and analysts and analysts and analysts and analysts and analysts and analysts and analysts and analysts analysts and analysts and analysts and analysts and,analysts and analysts and analysts and analysts and analysts and analysts and analysts and analysts and analysts and analysts analysts and analysts and analysts and analysts and analysts and
2 2 2 2 2 2 2 2 2 2 2 2 2 2 2 2 2 2 2 2 2 2 2 2 2 2 2 2 2 2,2 2 2 2 2 2 2 2 2 2 2 2 2 2 2 2 2 2 2 2 2 2 2 2 2 2 2 2 2 ,m 2m 2m 2m 2m 2m 2m 2m 2m 2m 2m 2m 2m 2m 2m 2,cent per cent per cent per cent per cent per cent per cent per cent per cent per cent per cent per cent per cent per cent per cent per,2 per cent per cent per cent per cent per cent per cent per cent per cent per cent per cent per cent per cent per cent per cent per
I I. I. I. I. I. I. I. I. I. I. I. I. I. I. I,. I. I. I. I. I. I. I. I. I. I. I. I. I. I. I,I I. I. I. I. I. I. I. I I. I. I. I. I. I. I.,I I. I. I. I. I. I. I I. I. I. I. I. I. I. I.,I I. I. I. I. I. I. I. I. I I. I. I. I. I. I.
I I and I and I and I and I and I and I and I and I and I and I and I and I and I and I,I and I and I and I and I and I and I and I and I and I and I and I and I and I and I and,and I and I and I and I and I and I and I and I and I and I and I and I and I and I and I,stocks I and I and I and I and I and I and I and I and I and I and I and I and I and I and I,with I and I and I and I and I and I and I and I and I and I and I and I and I and I and I
50 50 $ 50 $ 50 $ 50 $ 50 $ 50 $ 50 $ 50 $ 50 $ 50 $ 50 $ 50 $ 50 $ 50 $ 50,50 50 $ 50 $ 50 50 $ 50 $ 50 $ 50 $ 50 $ 50 $ 50 $ 50 $ 50 $ 50 $ 50 $ 50 $,50 50 $ 50 $ 50 50 $ 50 50 $ 50 $ 50 $ 50 $ 50 $ 50 $ 50 $ 50 $ 50 $ 50 $ 50,50 50 $ 20 $ 50 $ 50 $ 50 $ 50 $ 50 $ 50 $ 50 $ 50 $ 50 $ 50 $ 50 $ 50 $ 50,50 50 $ 50 $ 50 50 $ 50 $ 50 50 $ 50 $ 50 $ 50 $ 50 $ 50 $ 50 $ 50 $ 50 $ 50
the day of the day of the day of the day of the day of the day of the day of the day of the day of the day of,"$, $ 1, $ 1, $ 1, $ 1, $ 1, $ 1, $ 1, $ 1, $ 1, $","95 of the $ 1 to $ 1, $ 1 to $ 1, $ 1 to $ 1, $ 1 to $ 1, $ 1 to","$, $ 1, $ 1, $ 1, $ 1, $ 1, $ 1, $ 1, $ 1, $ 1 $ 1",19 per cent of the $ 1 to $ 1 per cent of the $ 1 to $ 1 per cent of the $ 1 to $ 1 per cent
profits from the profits from the profits from the profits from the profits from the profits from the profits from the profits from the profits from the profits from the,cloud from the cloud to the cloud to the cloud to the cloud to the cloud to the cloud to the cloud to the cloud to the cloud to the,cast from the cast to the cast to the cast to the cast to the cast to the cast to the cast to the cast to the cast to the,profits from the profits from the profits from the profits from the profits from the profits from the profits from the profits from the profits from the profits from profits,profits from the profits from the profits from the profits from the profits from the profits from the profits from the profits from the profits from profits from the profits
93 c. c. c. c. c. c. c. c. c. c. c. c. c. c. c,44 c. c. c. c. c. c. c. c. c. c. c. c. c. c. c,"c, c. c. c. c. c. c. c. c. c. c. c. c. c. c.",families with families with families with families with families with families with families with families with families with families with families with families with families with families with families,93 c. c. c. c. c. c. c. c. c. c. c. c. c c. c.
0 0 0 0 0 0 0 0 0 0 0 0 0 0 0 0 0 0 0 0 0 0 0 0 0 0 0 0 0 0,300 0 0 0 0 0 0 0 0 0 0 0 0 0 0 0 0 0 0 0 0 0 0 0 0 0 0 0 0 0,p 0 0 0 0 0 0 0 0 0 0 0 0 0 0 0 0 0 0 0 0 0 0 0 0 0 0 0 0 0,amp 0 0 0 0 0 0 0 0 0 0 0 0 0 0 0 0 0 0 0 0 0 0 0 0 0 0 0 0 0,pp 0 0 0 0 0 0 0 0 0 0 0 0 0 0 0 0 0 0 0 0 0 0 0 0 0 0 0 0
I I I I I I I I I I I I I I I I I I I I I I I I I I I I I I,I I I I I I I I I I I I I I I I I I I I I I I I I I I I I and,I I I I I I I I I I I I I I I I I I I I I I I I I I I I I with,I I and I and I and I and I and I and I and I and I and I and I and I and I and I and I,I and I and I and I and I and I and I and I and I and I and I and I and I and I and I and
name and a name and a name and a name and a name and a name and a name and a name and a name and a name and a,its a name and a name and a name and a name and a name and a name and a name and a name and a name and a name,. a. m. and a. m. and a. m. and a. m. and a. m. and a. m.,name and a name and a name and a name and a name and a name and a name and a name and a name and a name and name,name and a name and a name and a name and a name and a name and a name and a name and a name and name and a name
especially for him as well as for him as well as for him as well as for him as well as for him as well as for him as well,have with him as well as with him as well as with him as well as with him as well as with him as well as with him as well,about for him as well as for him as well as for him as well as for him as well as for him as well as for him as well,since for him as well as for him as well as for him as well as for him as well as for him as well as for him as well,last for him as well as for him as well as for him as well as for him as well as for him as well as for him as well
said and said and said and said and said and said and said and said and said and said and said and said and said and said and said and,discussions and discussions and discussions and discussions and discussions and discussions and discussions and discussions and discussions and discussions and discussions and discussions and discussions and discussions and discussions,ne tes tes tes tes tes tes tes tes tes tes tes tes tes tes t,"t, tes tes tes tes tes tes tes tes tes tes tes tes tes tes","j, tes tes tes tes tes tes tes tes tes tes tes tes tes tes"
in 16 in 16 in 16 in 16 in 16 in 16 in 16 in 16 in 16 in 16 in 16 in 16 in 16 in 16 in 16,to 16 in 16 in 16 in 16 in 16 in 16 in 16 in 16 in 16 in 16 in 16 in 16 in 16 in 16 in 16,percent in 16 percent in 16 percent in 16 percent in 16 percent in 16 percent in 16 percent in 16 percent in 16 percent in 16 percent in 16,more 16 in 16 in 16 in 16 in 16 in 16 in 16 in 16 in 16 in 16 in 16 in 16 in 16 in 16 in 16,in 16 in 16 in in 16 in 16 in 16 in 16 in 16 in 16 in 16 in 16 in 16 in 16 in 16 in 16 in
- and - and - and - and - and - and - and - and - and - and - and - and - and - and - and,- and - and - and - and - and - and - and - and - - and - and - and - and - and - and -,- and - and - and - and - and - and - and - - and - and - and - and - and - and - and -,- and - and - and - and - and - and - and and - and - and - and - and - and - and - and -,- and - and - and - and - and - and - and - and - and - - and - and - and - and - and -
W of the W of the W of the W of the W of the W of the W of the W of the W of the W of the,W of the W of the W of the W of the W of the W of the W of the W of W of the W of the W,W of the W of the W of the W of the W of the W of the W of the W of the W of the W of W,W of the W of the W of the W of the W of the W of the W of the W of the W of W of the W,W of the W of the W of the W of the W of the W of the W of W of the W of the W of the W
Sec of Sec of Sec of Sec of Sec of Sec of Sec of Sec of Sec of Sec of Sec of Sec of Sec of Sec of Sec of,Sec of Sec of Sec of Sec of Sec of Sec of Sec of Sec of Sec of Sec of Sec of Sec of Sec of Sec of Sec Sec,Sec of Sec of Sec of Sec of Sec of Sec of Sec of Sec of Sec of Sec of Sec of Sec of Sec of Sec Sec of Sec,Sec of Sec of Sec of Sec of Sec of Sec of Sec of Sec of Sec of Sec of Sec of Sec of Sec Sec of Sec of Sec,Sec of Sec of Sec of Sec of Sec of Sec of Sec of Sec of Sec of Sec of Sec of Sec Sec of Sec of Sec of Sec
up it up a wall up a wall up a wall up a wall up a wall up a wall up a wall up a wall up a wall up,the it up a wall up a wall up a wall up a wall up a wall up a wall up a wall up a wall up a wall up,up it up a wall up a wall up a wall up a wall up a wall up a wall up up a wall up a wall up a wall,the it up a wall up a wall up a wall up a wall up a wall up a wall up up a wall up a wall up a wall,up it up a wall up a wall up a wall up a wall up a wall up a wall up a wall up up a wall up a wall
saw which led to a paper which led to a paper which led to a paper which led to a paper which led to a paper which led to a,paper to a paper which was a paper which was a paper which was a paper which was a paper which was a paper which was a paper which was,40 a week to 40 a week to 40 a week to 40 a week to 40 a week to 40 a week to 40 a week to 40 a,led which led to a paper which led to a paper which led to a paper which led to a paper which led to a paper which led to a,"paper, which was a paper which was a paper which was a paper which was a paper which was a paper which was a paper which was a paper"
issues has also been limited but has also been limited but has also been limited but has also been limited but has also been limited but has also been limited,issues has also been limited but has also been limited but has also been limited but has been limited but has also been limited but has also been limited but,issues has also been limited but has also been limited but has also been limited but has also been limited but has been limited but has also been limited but,issues has also been limited but has also been limited but has also been limited but has also been limited but has also been limited but has been limited but,issues has also been limited but has also been limited but has also also been limited but has also been limited but has also been limited but has also been
with that with that with that with that with that with that with that with that with that with that with that with that with that with that with that,planet with that planet that planet that planet that planet that planet that planet that planet that planet that planet that planet that planet that planet that planet that planet,with that with that with that that with that with that with that with that with that with that with that with that with that with that with that with,with that with that that with that with that with that with that with that with that with that with that with that with that with that with that with,with that with that with that with that with that with that with that with that with that with that that with that with that with that with that with
