one of the knights of the knights of the knights of the knights of the knights of the knights of the knights of the knights of the knights of the,most of the knights of the knights of the knights of the knights of the knights of the knights of the knights of the knights of the knights of the,the office of the office of the office of the office of the office of the office of the office of the office of the office of the office of,office of the executive office of the executive office of the executive office of the executive office of the executive office of the executive office of the executive office of,most of the most senior of the senior of the senior of the senior of the senior of the senior of the senior of the senior of the senior of
yards of yards of yards of yards of yards of yards of yards of yards of yards of yards of yards of yards of yards of yards of yards of,seven of seven of seven of seven of seven of seven of seven of seven of seven of seven of seven of seven of seven of seven of seven of,Michigan of Michigan of Michigan State of Michigan of Michigan of Michigan of Michigan of Michigan of Michigan of Michigan of Michigan of Michigan of Michigan of Michigan of Michigan,yards of yards of yards of yards yards of yards of yards of yards of yards of yards of yards of yards of yards of yards of yards of yards,penalties of penalties of penalties of penalties of penalties of penalties of penalties of penalties of penalties of penalties of penalties of penalties of penalties of penalties of penalties
the work on the work on the work on the work on the work on the work on the work on the work on the work on the work on,how the work on the work on the work on the work on the work on the work on the work on the work on the work on the work,with the work on the work on the work on the work on the work on the work on the work on the work on the work on the work,By the work on the work on the work on the work on the work on the work on the work on the work on the work on the work,. the work on the work on the work on the work on the work on the work on the work on the work on the work on the work
know I know I know I know I know I know I know I know I know I know I know I know I know I know I know I,I I know I know I know I know I know I know I know I know I know I know I know I know I know I know I,? I know I know I know I know I know I know I know I know I know I know I know I know I know I know I,you you know I know I know I know I know I know I know I know I know I know I know I know I know I know I,well I know I know I know I know I know I know I know I know I know I know I know I know I know I know I
games in four games in four games in four games in four games in four games in four games in four games in four games in four games in four,games four games in four games in four games in four games in four games in four games in four games in four games in four games in four games,days in four days in four days in four days in four days in four days in four days in four days in four days in four days in four,Tigers Tigers Tigers Tigers Tigers Tigers Tigers Tigers Tigers Tigers Tigers Tigers Tigers Tigers Tigers Tigers Tigers Tigers Tigers Tigers Tigers Tigers Tigers Tigers Tigers Tigers Tigers Tigers Tigers,four games in four games in four games in four games in four games in four games in four games in four games in four games in four games in
I I. I. I. I. I. I. I. I. I. I. I. I. I. I. I,. I. I. I. I. I. I. I. I. I. I. I. I. I. I. I,I I. I. I. I. I. I. I. I I. I. I. I. I. I. I.,I I. I. I. I. I. I. I I. I. I. I. I. I. I. I.,I I. I. I. I. I. I. I. I. I I. I. I. I. I. I.
Soviet and the Soviet Union and the Soviet Union and the Soviet Union and the Soviet Union and the Soviet Union and the Soviet Union and the Soviet Union and,Nazi the Soviet Union by the Soviet Union by the Soviet Union by the Soviet Union by the Soviet Union by the Soviet Union by the Soviet Union by the,Soviet and Soviet Union and the Soviet Union and the Soviet Union and the Soviet Union and the Soviet Union and the Soviet Union and the Soviet Union and the,the Soviet Union and the Soviet Union and the Soviet Union and the Soviet Union and the Soviet Union and the Soviet Union and the Soviet Union and the Soviet,both the Soviet Union and the Soviet Union and the Soviet Union and the Soviet Union and the Soviet Union and the Soviet Union and the Soviet Union and the
"'s "" "" "" "" "" "" "" "" "" "" "" "" "" "" "" "" "" "" "" "" "" "" "" "" "" "" "" "" ""","""'s "" "" "" "" "" "" "" "" "" "" "" "" "" "" "" "" "" "" "" "" "" "" "" "" "" "" """,".'s "" "" "" "" "" "" "" "" "" "" "" "" "" "" "" "" "" "" "" "" "" "" "" "" "" "" ""","Design's "" "" "" "" "" "" "" "" "" "" "" "" "" "" "" "" "" "" "" "" "" "" "" "" "" "" """,".s. "" "" "" "" "" "" "" "" "" "" "" "" "" "" "" "" "" "" "" "" "" "" "" "" "" "" """
expanded and expanded and expanded and expanded and expanded and expanded and expanded and expanded and expanded and expanded and expanded and expanded and expanded and expanded and expanded,expanded and expanded and expanded and expanded and expanded and and expanded and expanded and expanded and expanded and expanded and expanded and expanded and expanded and expanded and,expanded and expanded and expanded and expanded and expanded and expanded and and expanded and expanded and expanded and expanded and expanded and expanded and expanded and expanded and,expanded and expanded and expanded and expanded and expanded and expanded and expanded and and expanded and expanded and expanded and expanded and expanded and expanded and expanded and,expanded and expanded and expanded and expanded and expanded and expanded and expanded and expanded and expanded and expanded and expanded and expanded and expanded and expanded to a
months it was the 18 months it was the 18 months it was the 18 months it was the 18 months it was the 18 months it was the 18,months it was on the 18 months it was on the 18 months it was on the 18 months it was on the 18 months it was on the 18,' on the 18 months it was on the 18 months it was on the 18 months it was on the 18 months it was on the 18 months it,months on the 18 months it was on the 18 months it was on the 18 months it was on the 18 months it was on the 18 months it,18 it was on the 18 months it was on the 18 months it was on the 18 months it was on the 18 months it was on the 18
Grand on 24 October 2011. Grand on 24 October 2011. Grand on 24 October 2011. Grand on 24 October 2011. Grand on 24 October 2011.,W on 24 October 2011. W on 24 October 2011. W on 24 October 2011. W on 24 October 2011. W on 24 October 2011.,Grand on 24 June 2011. Grand on 24 June 2011. Grand on 24 June 2011. Grand on 24 June 2011. Grand on 24 June 2011.,W on 24 June 2011. W on 24 June 2011. W on 24 June 2011. W on 24 June 2011. W on 24 June 2011.,held on 24 October 2011. in October 2011. in October 2011. in October 2011. in October 2011. in October 2011. in October 2011.
pain in the pain in the pain in the pain in the pain in the pain in the pain in the pain in the pain in the pain in the,pain in the pain in the pain in the pain in the pain in the pain in the pain in the pain in the pain in the pain in pain,pain in the pain in the pain in the pain in the pain in the pain in the pain in the pain in the pain in pain in the pain,pain in the pain in the pain in the pain in the pain in the pain in the pain in the pain in pain in the pain in the pain,pain in the pain in the pain in the pain in the pain in the pain in the pain in pain in the pain in the pain in the pain
. a. a. a. a. a. a. a. a. a. a. a. a. a. a. a,. a. a. a. a. a. a. a a. a. a. a. a. a. a. a.,. a. a. a. a. a. a a. a. a. a. a. a. a. a. a.,. a. a. a. a. a. a. a. a a. a. a. a. a. a. a.,. a. a. a. a. a. a. a. a. a a. a. a. a. a. a.
a for the Missa for the Missa for the Missa for the Missa for the Missa for the Missa for the Missa for,a for the Missa for the Missa for the Missa for the Missa for the Missa for the Missa for Missa for the,a for the Missa for the Missa for the Missa for the Missa for the Missa for Missa for the Missa for the,a for the Missa for the Missa for the Missa for the Missa for Missa for the Missa for the Missa for the,a for the Missa for the Missa for the Missa for the Missa for the Missa for the Missa for the Missa Miss
book of a book of a book of a book of a book of a book of a book of a book of a book of a book of a,book a book of a book of a book of a book of a book of a book of a book of a book of a book of a book,Year of a Year of a Year of a Year of a Year of a Year of a Year of a Year of a Year of a Year of a,of a book of a book of a book of a book of a book of a book of a book of a book of a book of a book,significant a book of a book of a book of a book of a book of a book of a book of a book of a book of a book
I I I I I I I I I I I I I I I I I I I I I I I I I I I I I I,I I I I I I I I I I I I I I I I I I I I I I I I I I I I I the,I I I the I the I the I the I the I the I the I the I the I the I the I the I the I the,I I I I I I I I I I I I I I I I I I I I I I I I I I I I I by,I I I I I I I I I I I I I I I I I I I I I I I I I I I I I u
1959 on 29 March 1959. on 29 March 1959. on 29 March 1959. on 29 March 1959. on 29 March 1959. on 29 March 1959,while on March 29 while on March 29 while on March 29 while on March 29 while on March 29 while on March 29 while on March 29 while on,", on March 29. March 29. March 29. March 29. March 29. March 29. March 29. March 29. March 29. March",.. on March 29. March 29. March 29. March 29. March 29. March 29. March 29. March 29. March 29.,while on March 29. March 29. March 29. March 29. March 29. March 29. March 29. March 29. March 29. March
Fox and Fox and Fox and Fox and Fox and Fox and Fox and Fox and Fox and Fox and Fox and Fox and Fox and Fox and Fox and,1991 in 1991 and 1991 in 1991 and 1991 in 1991 and 1991 in 1991 and 1991 in 1991 and 1991 in 1991 and 1991 in 1991 and 1991 in,Fox and Fox and Fox and Fox and Fox and Fox and Fox and Fox and Fox and Fox and Fox and Fox and Fox and Fox and Fox in,Fox and Fox and Fox and Fox and Fox Fox and Fox and Fox and Fox and Fox and Fox and Fox and Fox and Fox and Fox and Fox,Fox and Fox and Fox and Fox and Fox and Fox and Fox Fox and Fox and Fox and Fox and Fox and Fox and Fox and Fox and Fox
storm on a storm on a storm on a storm on a storm on a storm on a storm on a storm on a storm on a storm on a,earth on a storm on a storm on a storm on a storm on a storm on a storm on a storm on a storm on a storm on a,earth on a storm on a storm on a storm on storm on storm on storm on storm on storm on storm on storm on storm on storm on storm,earth on a storm on a storm on a storm on a storm on storm on storm on storm on storm on storm on storm on storm on storm on,earth on a storm on a storm on a storm on a storm on a storm on a storm on a storm on a storm on storm on a storm
team the team of the team of the team of the team of the team of the team of the team of the team of the team of the team,team of the team of the team of the team of the team of the team of the team of the team of the team of the team of the,of the team of the team of the team of the team of the team of the team of the team of the team of the team of the team,the team of the team of the team of the team of the team of the team of the team of the team of the team of the team of,than the team of the team of the team of the team of the team of the team of the team of the team of the team of the team
track in a track in a track in a track in a track in a track in a track in a track in a track in a track in a,week in a week in a week in a week in a week in a week in a week in a week in a week in a week in a,year in a year in a year in a year in a year in a year in a year in a year in a year in a year in a,track in a year in a year in a year in a year in a year in a year in a year in a year in a year in a,week in a year in a year in a year in a year in a year in a year in a year in a year in a year in a
Cha Cha Cha Cha Cha Cha Cha Cha Cha Cha Cha Cha Cha Cha Cha Cha Cha Cha Cha Cha Cha Cha Cha Cha Cha Cha Cha Cha Cha,who his character was who he was who he was who he was who he was who he was who he was who he was who he was who he,character was his character who was his character who was his character who was his character who was his character who was his character who was his character who was,he he was replaced who was replaced who was replaced who was replaced who was replaced who was replaced who was replaced who was replaced who was replaced who was,in he was replaced who was replaced who was replaced who was replaced who was replaced who was replaced who was replaced who was replaced who was replaced who was
a's life as a life as a life as a life as a life as a life as a life as a life as a life as a,as's life as a life as a life as a life as a life as a life as a life as a life as a life as a,cha's life as a life as a life as a life as a life as a life as a life as a life as a life as a,as's life as a life as a life as a life as a life as a life as a life as life as a life as a life,as's life as a life as a life as a life as a life as a life as life as a life as a life as a life
the one that is the one that is the one that is the one that is the one that is the one that is the one that is the one,that is the one that is the one that is the one that is the one that is the one that is the one that is the one that is,the is the one that is the one that is the one that is the one that is the one that is the one that is the one that is,one is the one that is the one that is the one that is the one that is the one that is the one that is the one that is,the one that is the one that is the one that is the one that is the one that is the one that is the one the one that is
she and she and she and she and she and she and she and she and she and she and she and she and she and she and she and,", and she and she and she and she and she and she and she and she and she and she and she and she and she and she and",but but she and she and she and she and she and she and she and she and she and she and she and she and she and she and,first first and second in first and second in first and second in first and second in first and second in first and second in first and second in first,second and second in first and second in first and second in first and second in first and second in first and second in first and second in first and
allowed's teams to take on the professional teams to take on the teams to take on the teams to take on the teams to take on the teams,allowed's teams to take on the professional teams to take on the professional teams to take on the professional teams to take on the professional teams to take,allowed's teams to take on the professional teams to take on the professional teams to take on the teams to take on the teams to take on the,allowed's teams to take on the professional teams to take on the teams to take on the professional teams to take on the teams to take on the,allowed's teams to take on the professional teams to take on the professional teams to take on the teams to take on the professional teams to take on
final to the final of the final of the final of the final of the final of the final of the final of the final of the final of the,. of the final stage to the final stage to the final stage to the final stage to the final stage to the final stage to the final stage to,stage of the final stage of the final stage of the final stage of the final stage of the final stage of the final stage of the final stage of,final to the final stage of the final stage to the final stage to the final stage to the final stage to the final stage to the final stage to,final of the final stage of the final stage of the final stage of the final stage of the final stage of the final stage of the final stage of
I I I I I I I I I I I I I I I I I I I I I I I I I I I I I I,I I It I I I I I I I I I I I I I I I I I I I I I I I I I I I,I I I It I I I I I I I I I I I I I I I I I I I I I I I I I I,I I I I I I I I I I I I I I I I I I I I I I I I I I I I I It,I I I I It I I I I I I I I I I I I I I I I I I I I I I I I I
Man of the Man of the Man of the Man of the Man of the Man of the Man of the Man of the Man of the Man of the,Man by the Man by the Man by the Man by the Man by the Man by the Man by the Man by the Man by the Man by the,Man the Man of the Man of the Man of the Man of the Man of the Man of the Man of the Man of the Man of the Man,Man of the Man of the Man of the Man of the Man of the Man of the Man of the Man of the Man of the Man of Man,Man of the Man of the Man of the Man of the Man of the Man of the Man of the Man of the Man of Man of the Man
she when she was in a helicopter when she was in a helicopter when she was in a helicopter when she was in a helicopter when she was in a,a when she was in a helicopter when she was in a helicopter when she was in a helicopter when she was in a helicopter when she was in a,fired in September 2010 when she was fired when she was fired when she was fired when she was fired when she was fired when she was fired when she,fired in September 2010 when she was fired in September 2010 when she was fired in September 2010 when she was fired in September 2010 when she was fired in,member when she was in a helicopter when she was in a helicopter when she was in a helicopter when she was in a helicopter when she was in a
Yeah. Yeah. Yeah. Yeah. Yeah. Yeah. Yeah. Yeah. Yeah. Yeah. Yeah. Yeah. Yeah. Yeah. Yeah.,Yeah. Yeah. Yeah. Yeah. Yeah Yeah. Yeah. Yeah. Yeah. Yeah. Yeah. Yeah. Yeah. Yeah. Yeah. Yeah,Yeah. Yeah. Yeah. Yeah. Yeah. Yeah. Yeah. Yeah. Yeah. Yeah. Yeah. Yeah. Yeah. Yeah. Yeah and,Yeah. Yeah. Yeah. Yeah. Yeah. Yeah. Yeah. Yeah. Yeah. Yeah. Yeah. Yeah. Yeah. Yeah. Yeah in,process in the process and in the process and in the process and in the process and in the process and in the process and in the process and in
last of last weeks of last weeks of last weeks of last weeks of last weeks of last weeks of last weeks of last weeks of last weeks of last,Do. Do. Do. Do. Do. Do. Do. Do. Do. Do. Do. Do. Do. Do. Do.,last of last weeks of last weeks of last weeks of last weeks of last weeks of last weeks of last last weeks of last weeks of last weeks of,last of last weeks of last weeks of last weeks of last weeks of last weeks of last last weeks of last weeks of last weeks of last weeks of,last of last weeks of last weeks of last weeks of last weeks of last weeks of last weeks of last weeks of last last weeks of last weeks of
election by election by election by election by election by election by election by election by election by election by election by election by election by election by election by,Primary by election by election by election by election by election by election by election by election by election by election by election by election by election by election by,election by election by election by election by election by election by election by election by election by election by election by election by election by election by election at,election by election by election by election by by election by election by election by election by election by election by election by election by election by election by election,election by election by election by by election by election by election by election by election by election by election by election by election by election by election by election
take to take to themselves to take to themselves to take to themselves to take to themselves to take to themselves to take to themselves to take to themselves to,take to take to themselves to take to themselves to take themselves to take themselves to take themselves to take themselves to take themselves to take themselves to take themselves,take to take to themselves to take themselves to take themselves to take themselves to take themselves to take themselves to take themselves to take themselves to take themselves to,take to take to themselves to take to themselves to take to themselves to take themselves to take themselves to take themselves to take themselves to take themselves to take,take to take to themselves to take to themselves to take to themselves to take to themselves to take to themselves to take to themselves to take themselves to take
the will to the will to the will to the will to the will to the will to the will to the will to the will to the will to,the will to the will to the will to the will to the will to the will will to the will to the will to the will to the will,the will to the will to the will to the will to the will to the will to the will will to the will to the will to the will,the will to the will to the will to the will to the will will to the will to the will to the will to the will to the will,the will to the will to the will to the will to the will to the will to the will to the will will to the will to the will
school at a school at a school at a school at a school at a school at a school at a school at a school at a school at a,", a school at a school at a school at a school at a school at a school at a school at a school at a school at a school",school at a school at a school school at a school at a school at a school at a school at a school at a school at a school at,school a school at a school at a school at a school at a school at a school at a school at a school at a school at a school,there at a school at a school at a school at a school at a school at a school at a school at a school at a school at a
ennial next to the W. W. next to the W. W. next to the W. W. next to the W. W. next,W. W. W. in the W. W. in the W. W. in the W. W. in the W. W.,W. W. W. in the W. W. W. in the W. W. in the W. W. in the W.,ennial next to the W. W. next to the W. W. next to the W. W. next to W. W. next to,ennial next to the W. W. next to the W. W. next to the W. W. next next to the W. W.
the power of the power of the power of the power of the power of the power of the power of the power of the power of the power of,power of the power of the power of the power of the power of the power of the power of the power of the power of the power of the,power the power of the power of the power of the power of the power of the power of the power of the power of the power of the power,the power of the power of the power of the power of the power of the power of the power of the power of the power of power of the,the of the power of the power of the power of the power of the power of the power of the power of the power of the power of the
Gow Gow Gow Gow Gow Gow Gow Gow Gow Gow Gow Gow Gow Gow Gow Gow Gow Gow Gow Gow Gow Gow Gow Gow Gow Gow Gow Gow Gow,Leis Leis Leis Leis Leis Leis Leis Leis Leis Leis Leis Leis Leis Leis Leis,David David and David and David and David and David and David and David and David and David and David and David and David and David and David and David,Guis and Guis and Guis and Guis and Guis and Guis and Guis and Guis and Guis and Guis and,David and David and David and David and David and David and David and David and David and David and David and David and David and David and David and
still I. I. I. I. I. I. I. I. I. I. I. I. I. I. I,. I. I. I. I. I. I. I. I. I. I. I. I. I. I. I,I and I. I. I. I. I. I. I. I. I. I. I. I. I. I.,and I. I. I. I. I. I. I. I. I. I. I. I. I. I. I,today I. I. I. I. I. I. I. I. I. I. I. I. I. I. I
Australia and Australia in Australia and Australia in Australia and Australia in Australia and Australia in Australia and Australia in Australia and Australia in Australia and Australia in Australia and,the war in the war in the war in the war in the war in the war in the war in the war in the war in the war in,war in the war in the war in the war in the war in the war in the war in the war in the war in the war in the,Australia and Australia in Australia and Australia in Australia and Australia in Australia and Australia in Australia and Australia in Australia and Australia in Australia and Australia and Australia in,Australia and Australia in Australia and Australia in Australia and Australia in Australia and Australia in Australia and Australia in Australia and Australia in Australia and Australia and Australia and
control and control and control and control and control and control and control and control and control and control and control and control and control and control and control and,The control and control and control and control and control and control and control and control and control and control and control and control and control and control and control,for control and control and control and control and control and control and control and control and control and control and control and control and control and control and control,The and on and on and on and on and on and on and on and on and on and on and on and on and on and on and,and on and on and on and on and on and on and on and on and on and on and on and on and on and on and on
designed and designed and designed and designed and designed and designed and designed and designed and designed and designed and designed and designed and designed and designed and designed and,Johnson and Johnson and Johnson and Johnson and Johnson and Johnson and Johnson and Johnson and Johnson and Johnson and Johnson and Johnson and Johnson and Johnson and Johnson and,sound and sound and sound and sound and sound and sound and sound and sound and sound and sound and sound and sound and sound and sound and sound and,sound of sound and sound of sound of sound of sound of sound of sound of sound of sound of sound of sound of sound of sound of sound of,Johnson designed and designed and designed and designed and designed and designed and designed and designed and designed and designed and designed and designed and designed and designed and designed
