credit to the credit to the credit to the credit to the credit to the credit to the credit to the credit to the credit to the credit to the,assets to the assets to the assets to the assets to the assets to the assets to the assets to the assets to the assets to the assets to the,assets to the credit to the credit to the credit to the credit to the credit to the credit to the credit to the credit to the credit to the,credit to the credit to the credit to the credit to the credit to credit to the credit to the credit to the credit to the credit to the credit,credit to the credit to the credit to the credit to the credit to the credit to credit to the credit to the credit to the credit to the credit
pressure under pressure to a pressure under pressure to a pressure under pressure to a pressure under pressure to a pressure under pressure to a pressure under pressure to a,pressure under pressure to a pressure under pressure to a pressure under pressure to a pressure to a pressure to a pressure to a pressure to a pressure to a,pressure under pressure to a pressure under pressure under pressure to a pressure under pressure to a pressure under pressure to a pressure under pressure to a pressure under pressure,pressure under pressure to a pressure under pressure to a pressure under pressure to a pressure under pressure to a pressure to a pressure to a pressure to a pressure,pressure under pressure to a pressure under pressure to a pressure to a pressure to a pressure to a pressure to a pressure to a pressure to a pressure to
company the company that is the company that is the company that is the company that is the company that is the company that is the company that is the,company is the company that is the company that is the company that is the company that is the company that is the company that is the company that is,the will and the will and the will and the will and the will and the will and the will and the will and the will and the will and,the will and will and will and will and will and will and will and will and will and will and will and will and will and will and will,company and the company that is the company that is the company that is the company that is the company that is the company that is the company that is
t. t. t. t. t. t. t. t. t. t. t. t. t. t. t.,t. t. t. t. t. t. t. t. t. t. t. t. t. t t. t,t. t. t. t. t. t. t. t. t. t. t t. t. t. t. t,t. t. t. t. t. t. t. t. t. t. t. t t. t. t. t,t. t. t. t. t. t. t. t. t. t. t. t. t t. t. t
told the market when it told the market when it told the market when it told the market when it told the market when it told the market when it,told the market when it told the market when it told the market when it told the market when it told the market when it told the market when the,told the market when it told the market when it told the market when it told the market when it told the market when the market told the market when,it it when it told the market when it told the market when it told the market when it told the market when it told the market when it told,told the market when it told the market when it told the market when it told the market when the market told the market when it told the market when
confusion leading to confusion leading to confusion leading to confusion leading to confusion leading to confusion leading to confusion leading to confusion leading to confusion leading to confusion leading,leading to the confusion leading to the confusion leading to the confusion leading to the confusion leading to the confusion leading to the confusion leading to the confusion leading to,inquiry leading to an inquiry leading to an inquiry leading to an inquiry leading to an inquiry leading to an inquiry leading to an inquiry leading to an inquiry,has leading to the confusion leading to the confusion leading to the confusion leading to the confusion leading to the confusion leading to the confusion leading to the confusion leading,complete leading to the confusion leading to the confusion leading to the confusion leading to the confusion leading to the confusion leading to the confusion leading to the confusion leading
have to have to have to have to have to have to have to have to have to have to have to have to have to have to have to,have to have ale to have ale to have ale to have ale to have ale to have ale to have ale to have ale to have ale to have,assets to its assets to its assets to its assets to its assets to its assets to its assets to its assets to its assets to its assets to its,have to have to have to have to have to have to have to have to have to have to have to have to have to to have to have,have to have to have to have to have to have to have to have to have to have to have to have to have to have to to have
not to lose that he might lose that he might lose that he might lose that he might lose that he might lose that he might lose that he might,not to lose that he might not lose that he might not lose that he might not lose that he might not lose that he might not lose that he,customers that are not customers that are customers that are customers that are customers that are customers that are customers that are customers that are customers that are customers,such not to lose that he might lose that he might lose that he might lose that he might lose that he might lose that he might lose that he,pressure not to lose that he might lose that he might lose that he might lose that he might lose that he might lose that he might lose that he
company the company that is the company that is the company that is the company that is the company that is the company that is the company that is the,company is the company that is the company that is the company that is the company that is the company that is the company that is the company that is,the will and the will and the will and the will and the will and the will and the will and the will and the will and the will and,the will and will and will and will and will and will and will and will and will and will and will and will and will and will and will,company and the company that is the company that is the company that is the company that is the company that is the company that is the company that is
All to lose weight to lose weight to lose weight to lose weight to lose weight to lose weight to lose weight to lose weight to lose weight to lose,weight weight for weight for weight for weight for weight for weight for weight for weight for weight for weight for weight for weight for weight for weight for weight,weight for weight for weight for weight for weight for weight for weight for weight for weight for weight for weight for weight for weight for weight for weight for,weight to lose weight to lose weight to lose weight to lose weight to lose weight to lose weight to lose weight to lose weight to lose weight to lose,for to lose weight to lose weight to lose weight to lose weight to lose weight to lose weight to lose weight to lose weight to lose weight to lose
Did is and is and is and is and is and is and is and is and is and is and is and is and is and is and is,Did is and is and is and is and is and is is and is and is and is and is and is and is and is and is and,Did is and is and is and is and is and is and is is and is and is and is and is and is and is and is and,Did is and is and is and and is and is and is and is and is and is and is and is and is and is and is and,Did is and is and is and is and is is and is and is and is and is and is and is and is and is and is and
have to have the cover to have the cover to have the cover to have the cover to have the cover to have the cover to have the cover to,sell not to sell or not to sell or not to sell or not to sell or not to sell or not to sell or not to sell or not,the to the future is the future is the future is the future is the future is the future is the future is the future is the future is the,the to the future is to the future is to the future is to the future is to the future is to the future is to the future is to,assets to the future or to the future or to the future or to the future or to the future or to the future or to the future or to
En. En. En. En. En. En. En. En. En. En. En. En. En. En. En.,En. En. En. En.. En. En. En. En. En. En. En. En. En. En. En,En. En. En. En. En. En. En. En. En. En. En. En. En. En. En ,En. En. En. En.. En. En. En. En. En. En. En. En. En. En. ,En. En. En. En. En.. En. En. En. En. En. En. En. En. En. En
and of it ( and of it ( and of it ( and of it ( and of it ( and of it ( and of it ( and of,and of it and of it and of it and of it and of it and of it and of it and of it and of it and of it,( of it and of it and of it and of it and of it and of it and of it and of it and of it and of it,has of it and of it and of it and of it and of it and of it and of it and of it and of it and of it,who of it and of it and of it and of it and of it and of it and of it and of it and of it and of it
charge and charge and charge and charge and charge and charge and charge and charge and charge and charge and charge and charge and charge and charge and charge and,charge and charge charge and charge and charge and charge and charge and charge and charge and charge and charge and charge and charge and charge and charge and charge,charge and charge and charge charge and charge and charge and charge and charge and charge and charge and charge and charge and charge and charge and charge and charge,charge and charge and charge and charge charge and charge and charge and charge and charge and charge and charge and charge and charge and charge and charge and charge,a and rea and rea rea rea rea rea rea rea rea rea rea rea rea re
address and the address and the address and the address and the address and the address and the address and the address and the address and the address and the,address and the address to the address to the address to the address to the address to the address to the address to the address to the address to the,address and the address and the address and the address and the address and the address and the address and the address and the address and address and the address,address and the address and the address and the address and the address and the address and the address and the address and the address and the address and address,address and the address and the address and the address and the address and the address and the address and the address and address and the address and the address
going to the yon going to the yon going to the yon going to the yon going to the yon going to the yon,the to the yon to the yon to the yon to the yon to the yon to the yon to the yon to,y to the yon yon to the yon yon to the yon yon to the yon yon to the yon y,y to the yon to the yon to the yon to the yon to the yon to the yon to the yon to,y to the yon yon yon to the yon yon to the yon yon to the yon yon to the y
. c. c. c. c. c. c. c. c. c. c. c. c. c. c. c,c. c. c. c. c. c. c. c. c. c. c. c. c. c. c.,c c. c. c. c. c. c. c. c. c. c. c. c. c. c. c,. c. c. c. c. c. c. c. c. c. c. c. c. c c. c.,. c. c. c. c. c. c. c. c. c. c. c c. c. c. c.
I of I of I of I of I of I of I of I of I of I of I of I of I of I of I of,"., I of I of I of I of I of I of I of I of I of I of I of I of I of I of I",I of I of I of I I of I of I of I of I of I of I of I of I of I of I of I,I of I of I of I of I of I of I of I of I of I of I of I of I of I of I I,I of I of I of I of I of I of I of I of I of I of I of I of I of I I of I
financial as chief executive officer as chief executive officer as chief executive officer as chief executive officer as chief executive officer as chief executive officer as chief executive officer as,Re Re Re Re Re Re Re Re Re Re Re Re Re Re Re Re Re Re Re Re Re Re Re Re Re Re Re Re Re Re,financial as chief executive officer as chief financial officer as chief financial officer as chief financial officer as chief financial officer as chief financial officer as chief financial officer as,financial as chief executive officer as chief executive officer as chief financial officer as chief financial officer as chief financial officer as chief financial officer as chief financial officer as,stock as chief executive officer as chief executive officer as chief executive officer as chief executive officer as chief executive officer as chief executive officer as chief executive officer as
It It It It It It It It It It It It It It It It It It It It It It It It It It It It It It,je je je je je je je je je je je je je je je je je je je je je je je je je je je je je je,ahon a Itm a Itm a Itm a Itm a Itm a Itm a Itm a Itm a Itm a It,m Itm Itm Itm Itm Itm Itm Itm Itm Itm Itm Itm Itm Itm Itm It,It It It It It It It It It It It The It It It It It It It It It It It It It It It It It It
Me for the Me. for the Me. for the Me. for the Me. for the Me. for the Me. for the Me. for,sec. for the sec. for the sec. for the sec. for the sec. for the sec. for the sec. for the sec.,Me for the Me for the Me for the Me for the Me for the Me for the Me for the Me for the Me for the Me for the,Me for the Me. Me. Me. Me. Me. Me. Me. Me. Me. Me. Me. Me. Me. Me,Me for the Me. for the Me. for the Me. for the Me. for the Me. for the Me. for the Me. the
. a. t. t. t. t. t. t. t. t. t. t. t. t. t. t,. a. t. a. t. a. t. a. t. a. t. a. t. a. t. a,wall of the wall of the wall of the wall of the wall of the wall of the wall of the wall of the wall of the wall of the,. a. t. t. a. t. a. t. a. t. a. t. a. t. a. t,. a. t. t. t. t. a. t. t. t. t. t. t. t. t. t
m to the m to the m to the m to the m to the m to the m to the m to the m to the m to the,were the officials to the officials to the officials to the officials to the officials to the officials to the officials to the officials to the officials to the officials,m m to the m to the m to the m to the m to the m to the m to the m to the m to the m to,r to the ron to the ron to the ron to the ron to the ron to the ron to the ron to,m to the m to the m to the m to the m to m to the m to the m to the m to the m to the m
subsidiary subsidiary of its subsidiary of its subsidiary of its subsidiary of its subsidiary of its subsidiary of its subsidiary of its subsidiary of its subsidiary of its,officer of its own officer of its own officer of its own officer of its own officer of its own officer of its own officer of its own officer,subsidiary subsidiary of its own subsidiary of its own subsidiary of its own subsidiary of its own subsidiary of its own subsidiary of its own subsidiary of its,the chief executive officer of its chief executive officer of its chief executive officer of its chief executive officer of its chief executive officer of its chief executive officer of,subsidiary subsidiary of its subsidiary of its subsidiary subsidiary of its subsidiary of its subsidiary of its subsidiary of its subsidiary of its subsidiary of its subsidiary of
news to us and to us and to us and to us and to us and to us and to us and to us and to us and to us,more to us and to us and to us and to us and to us and to us and to us and to us and to us and to us,assuming to us and to us and to us and to us and to us and to us and to us and to us and to us and to us,bad to us and to us and to us and to us and to us and to us and to us and to us and to us and to us,more to us and more to us and more to us and more to us and more to us and more to us and more to us and more to
en o o o o o o o o o o o o o o o o o o o o o o o o o o o o o,en o oon oon oon oon oon oon oon oon oon oon oon oon oon oon,"imp, o o o o o o o o o o o o o o o o o o o o o o o o o o o o","imp, oon oon oon oon oon oon oon oon oon oon oon oon oon oon",m o r o m r o m r o m r o m r o m r o m r o m r o m r o m r
fast of the fast of the fast of the fast of the fast of the fast of the fast of the fast of the fast of the fast of the,fast of the fast of the fast of the fast of the fast of the fast of the fast of the fast of the fast of the fast of fast,fast of the fast of the fast of the fast of the fast of the fast of the fast of the fast of the fast of fast of the fast,fast of the fast of the fast of the fast of the fast of the fast of the fast of the fast of fast of the fast of the fast,fast of the fast of the fast of the fast of the fast of the fast of the fast of fast of the fast of the fast of the fast
a. a. u. u. u. u. u. u. u. u. u. u. u. u. u.,. a.w. a.w. a.w. a.w. a.w. a.w. a.w. a,. a. a. a. a. a. a. a. a. a. a. a. a. a. a. a,. a. and a. and a. and a. and a. and a. and a. and a. and a. and a.,wed a commission and a commission and a commission and a commission and a commission and a commission and a commission and a commission and a commission and a commission
. r. r. r. r. r. r. r. r. r. r. r. r. r. r. r,"h, h. h. h. h. h. h. h. h. h. h. h. h. h. h.",",. h. h. h. h. h. h. h. h. h. h. h. h. h. h.",. r. h. h. h. h. h. h. h. h. h. h. h. h. h. h,h r. h. h. h. h. h. h. h. h. h. h. h. h. h. h
the back of the back of the back of the back of the back of the back of the back of the back of the back of the back of,back of the back of the back of the back of the back of the back of the back of the back of the back of the back of the,from of the back of the back of the back of the back of the back of the back of the back of the back of the back of the,the back of the back of the back of the back of the back of the back of the back of the back of the back of back of the,the back of the back of the back of the back of the back of the back of the back of the back of back of the back of the
8 8 8 8 8 8 8 8 8 8 8 8 8 8 8 8 8 8 8 8 8 8 8 8 8 8 8 8 8 8,3 8 8 8 8 8 8 8 8 8 8 8 8 8 8 8 8 8 8 8 8 8 8 8 8 8 8 8 8 8,would fasten fasten fasten fasten fasten fasten fasten fasten fasten fasten fasten fasten fasten fasten fast,een een een een een een een een een een een een een een een e,8 8 8 8 8 8 8 8 8 8 8 8 8 8 8 8 8 8 8 8 8 8 8 8 8 8 8 8 8 e
", it is said that it is said that it is said that it is said that it is said that it is said that it is said that it",said is that it is said that it is said that it is said that it is said that it is said that it is said that it is said,it is said that it is said that it is said that it is said that it is said that it is said that it is said that it is,an it is said that it is said that it is said that it is said that it is said that it is said that it is said that it,k it is said that it is said that it is said that it is said that it is said that it is said that it is said that it
"k, o. o. o. o. o. o. o. o. o. o. o. o. o. o.",ce tes tes tes tes tes tes tes tes tes tes tes tes tes tes t,"k, o. t. t. t. t. t. t. t. t. t. t. t. t. t.",night the night the night the night the night the night the night the night the night the night the night the night the night the night the night the,",. t. o. t. o. t. o. t. o. t. o. t. o. t. o."
fast of a fast of a fast of a fast of a fast of a fast of a fast of a fast of a fast of a fast of a,fast of a fast of a fast of a fast of a fast of a fast of a fast of a fast of a fast of a fast of the,fast of a fast of a fast of a fast of a fast of a fast of a fast of a fast of a fast of a fast of fast,fast of a fast of a fast of a fast of a fast of a fast of a fast of a fast of a fast of fast of a fast,fast of a fast of a fast of a fast of a fast of a fast of a fast of a fast of fast of a fast of a fast
value in the value that the value that the value that the value that the value that the value that the value that the value that the value that the,value in the value in the value in the value in the value in the value in the value in the value in the value in the value in the,value the value in the value in the value in the value in the value in the value in the value in the value in the value in the value,2 in the 2 in the 2 in the 2 in the 2 in the 2 in the 2 in the 2 in the 2 in the 2 in the,value in the value that the value that the value that the value that the value that the value that the value that the value that the value the value
j. m. m. m. m. m. m. m. m. m. m. m. m. m. m.,m. m. m. m. m. m. m. m. m. m. m. m. m. m. m.,j. m. j. m. m. m. m. m. m. m. m. m. m. m. m.,j. m. j. m. j. m. m. m. m. m. m. m. m. m. m.,l. m. l. m. m. m. m. m. m. m. m. m. m. m. m.
bankers and bankers and bankers and bankers and bankers and bankers and bankers and bankers and bankers and bankers and bankers and bankers and bankers and bankers and bankers,get in and get in and get in and get in and get in and get in and get in and get in and get in and get in and,get and get in and get in and get in and get in and get in and get in and get in and get in and get in and get,faith and faith in faith and faith in faith in faith in faith in faith in faith in faith in faith in faith in faith in faith in faith in,faith and faith in faith and faith and faith and faith and faith and faith and faith and faith and faith and faith and faith and faith and faith and
u. s. s. s. s. s. s. s. s. s. s. s. s. s. s.,the power of the power of the power of the power of the power of the power of the power of the power of the power of the power of,ble the power of the power of the power of the power of the power of the power of the power of the power of the power of the power,yeah the power of the power of the power of the power of the power of the power of the power of the power of the power of the power,power of the power of the power of the power of the power of the power of the power of the power of the power of the power of the
anything at one time at one time at one time at one time at one time at one time at one time at one time at one time at one,time at one time at one time at one time at one time at one time at one time at one time at one time at one time at one,one at one time at one time at one time at one time at one time at one time at one time at one time at one time at one,at at one time at one time at one time at one time at one time at one time at one time at one time at one time at one,the at one time at one time at one time at one time at one time at one time at one time at one time at one time at one
get to get to get to get to get to get to get to get to get to get to get to get to get to get to get to,get get to get to get to get to get to get to get to get to get to get to get to get to get to get to get,the get to get to get to get to get to get to get to get to get to get to get to get to get to get to get,to get to get to get to get to get to get to get to get to get to get to get to get to get to get to get,exec get to get to get to get to get to get to get to get to get to get to get to get to get to get to get
left to the left to the left to the left to the left to the left to the left to the left to the left to the left to the,.. to the left to the left to the left to the left to the left to the left to the left to the left to the left to,the left to the left to the left to the left to the left to the left to the left to the left to the left to the left to,there to the left to the left to the left to the left to the left to the left to the left to the left to the left to the,to the left to the left to the left to the left to the left to the left to the left to the left to the left to the left
. r. r. r. r. r. r. r. r. r. r. r. r. r. r. r,anth. r. r. r. r. r. r. r. r. r. r. r. r. r. r.,reports and reports and reports and reports and reports and reports and reports and reports and reports and reports and reports and reports and reports and reports and reports and,but and it and it and it and it and it and it and it and it and it and it and it and it and it and it and,. and r. r. r. r. r. r. r. r. r. r. r. r. r. r.
02 to 9 / 8 / 9 / 9 / 9 / 9 / 9 / 9 / 9 / 9 / 9 / 9 / 9 / 9 /,6 to 1 in. 6 to 1 in. 6 to 1 in. 6 in. 6 to 1 in. 6 in. 6 to 1 in,8 to 1 in. 6 to 1 in. 6 to 1 in. 6 in. 6 to 1 in. 6 in. 6 to 1 in,6 to 1 in. 6 to 1 in. 6 to 1 in. 6 to 1 in. 6 in. 6 to 1 in. 6 in,8 to 1 in. 6 to 1 in. 6 to 1 in. 6 to 1 in. 6 in. 6 to 1 in. 6 in
4 4 4 4 4 4 4 4 4 4 4 4 4 4 4 4 4 4 4 4 4 4 4 4 4 4 4 4 4 4,ad an an an an an an an an an an an an an an an an an an an an an an an an an an an an an,Among an ad to an ad to an ad to an ad to an ad to an ad to an ad to an ad to an ad to an ad,ad an ad to an ad to an ad to an ad to an ad to an ad to an ad to an ad to an ad to an ad,an an ad to an ad to an ad to an ad to an ad to an ad to an ad to an ad to an ad to an ad
small the air and the air and the air and the air and the air and the air and the air and the air and the air and the air,the air and the air and the air and the air and the air and the air and the air and the air and the air and the air and,the to the air and to the air and to the air and to the air and to the air and to the air and to the air and to,among the air and the air and the air and the air and the air and the air and the air and the air and the air and the air,and to the air and to the air and to the air and to the air and to the air and to the air and to the air and to
1 1 1 1 1 1 1 1 1 1 1 1 1 1 1 1 1 1 1 1 1 1 1 1 1 1 1 1 1 1,I I I I I I I I I I I I I I I I I I I I I I I I I I I I I I,1 1 1 1 1 1 1 1 1 1 1 1 1 1 1 1 1 1 1 1 1 1 1 1 1 1 1 1 1 ,I I I I I I I I I I I I I I I I I I I I I I I I I I I I I ,34 1 1 1 1 1 1 1 1 1 1 1 1 1 1 1 1 1 1 1 1 1 1 1 1 1 1 1 1 1
"innacle, I of I of I of I of I of I of I of I of I of I of I of I of I of I of","innacle, I of I of I of I of I of I of I of I of I of I of I of I of I of I,","4, 4, 4, 4, 4, 4, 4, 4, 4, 4, 4, 4, 4, 4, 4,","4, 4, 4, 4, 4,, 4, 4, 4, 4, 4, 4, 4, 4, 4, 4","4, 4, 4, 4,, 4, 4, 4, 4, 4, 4, 4, 4, 4, 4, 4"
