CBS and CBS and CBS and CBS and CBS and CBS and CBS and CBS and CBS and CBS and CBS and CBS and CBS and CBS and CBS and,scientists and scientists and scientists and scientists and scientists and scientists and scientists and scientists and scientists and scientists and scientists and scientists and scientists and scientists and scientists,development and development of development and development and development and development and development and development and development and development and development and development and development and development and development and,development and development of a development of a development of a development of a development of a development of a development of a development of a development of a development,development and development of development and development of development and development of development and development of development and development of development and development of development and development of development and
Landis Landis Landis Landis Landis Landis Landis Landis Landis Landis Landis Landis Landis Landis Landis,. Landis. Landis. Landis. Landis. Landis. Landis. Landis. Landis. Landis. Landis,in the Land in the Land in the Land in the Land in the Land in the Land in the Land in the Land in the Land in the Land,Landis Landis Landis Landis Landis Landis Landis Landis Landis Landis Landis Landis Landis Landis in the,view the view in the view in the view in the view in the view in the view in the view in the view in the view in the view
been of wide acclaim has been of wide acclaim has been of wide acclaim has been of wide acclaim has been of wide acclaim has been of wide acclaim has,been of wide acclaim has been of wide acclaim has been of wide acclaim has been of wide acclaim has been of wide acclaim has been of wide acclaim of,been of wide acclaim has been of wide acclaim has been of wide acclaim of wide acclaim of wide acclaim of wide acclaim of wide acclaim of wide acclaim of,been of wide acclaim has been of wide acclaim has been of wide acclaim has been of wide acclaim has been of wide acclaim of wide acclaim of wide acclaim,been of wide acclaim has been of wide acclaim has been of wide acclaim has been of wide acclaim of wide acclaim of wide acclaim of wide acclaim of wide
abortion and abortion and abortion and abortion and abortion and abortion and abortion and abortion and abortion and abortion and abortion and abortion and abortion and abortion and abortion and,comments and comments and comments and comments and comments and comments and comments and comments and comments and comments and comments and comments and comments and comments and comments and,1992 in 1992 and 1992 in 1992 and 1992 in 1992 and 1992 in 1992 and 1992 in 1992 and 1992 in 1992 and 1992 in 1992 and 1992 in,1992 in 1992 and 1992 in 1992 and 1992 in 1992 in 1992 and 1992 in 1992 and 1992 in 1992 and 1992 in 1992 and 1992 in 1992 and,1992 in 1992 and 1992 in 1992 and 1992 in 1992 and 1992 in 1992 in 1992 and 1992 in 1992 and 1992 in 1992 and 1992 in 1992 and
Yeah. Yeah. Yeah. Yeah. Yeah. Yeah. Yeah. Yeah. Yeah. Yeah. Yeah. Yeah. Yeah. Yeah. Yeah.,yeah. Yeah. Yeah. Yeah. Yeah. Yeah. Yeah. Yeah. Yeah. Yeah. Yeah. Yeah. Yeah. Yeah. Yeah.,Yeah. Yeah. Yeah. yeah. Yeah. Yeah. Yeah. Yeah. Yeah. Yeah. Yeah. Yeah. Yeah. Yeah. Yeah.,Yeah. Yeah. yeah. Yeah. Yeah. Yeah. Yeah. Yeah. Yeah. Yeah. Yeah. Yeah. Yeah. Yeah. Yeah.,Yeah. Yeah. Yeah. Yeah. yeah. Yeah. Yeah. Yeah. Yeah. Yeah. Yeah. Yeah. Yeah. Yeah. Yeah.
. o. o. o. o. o. o. o. o. o. o. o. o. o. o. o,. o. o. o. o. o. o. o. o. o. o. o. o. o. o o.,. o. o. o. o. o. o. o. o. o. o. o. o. o o. o.,. o. o. o. o. o. o. o. o. o. o. o. o o. o. o.,. o. o. o. o. o. o. o. o. o. o. o o. o. o. o.
h. h. h. h. h. h. h. h. h. h. h. h. h. h. h.,h. h. h. h. h. h. h. h. h. h. h. h. h. h. h h,h. h. h. h. h. h. h. h. h. h. h. h. h. h h. h,h. h. h. h. h. h. h. h. h. h. h. h. h h. h. h,h. h. h. h. h. h. h. h. h. h. h. h h. h. h. h
I I and I and I and I and I and I and I and I and I and I and I and I and I and I and I,I and I and I and I and I and I and I and I and I and I and I and I and I and I and I and,and I and I and I and I and I and I and I and I and I and I and I and I and I and I and I,with I and I and I and I and I and I and I and I and I and I and I and I and I and I and I,", I and I and I and I and I and I and I and I and I and I and I and I and I and I and I"
The ist ist ist ist ist ist ist ist ist ist ist ist ist ist is,", yt yt yt yt yt yt yt yt yt yt yt yt yt yt y",", yt yt yn yn yn yn yn yn yn yn yn yn yn yn y",", yt yt yt yn yn yn yn yn yn yn yn yn yn yn y",", yt yn yn yn yn yn yn yn yn yn yn yn yn yn y"
country was a country that was a country that was a country that was a country that was a country that was a country that was a country that was,reader to be a traitor and a traitor to be a traitor to be a traitor to be a traitor to be a traitor to be a traitor to be,iah to be a traitor and a traitor to be a traitor to be a traitor to be a traitor to be a traitor to be a traitor to be,was to be a traitor and a traitor and a traitor and a traitor and a traitor and a traitor and a traitor and a traitor and a traitor and,that to be a traitor and a traitor and a traitor and a traitor and a traitor and a traitor and a traitor and a traitor and a traitor and
volume of the volume of the volume of the volume of the volume of the volume of the volume of the volume of the volume of the volume of the,I of the I of the I of the I of the I of the I of the I of the I of the I of the I of the,third of a third of a third of a third of a third of a third of a third of a third of a third of a third of a,third of the volume of the volume of the volume of the volume of the volume of the volume of the volume of the volume of the volume of the,", of the volume of the volume of the volume of the volume of the volume of the volume of the volume of the volume of the volume of the"
He He. He. He. He. He. He. He. He. He. He. He. He. He. He. He,He. He. He. He. He. He. He. He. He. He. He. He. He. He. He.,He He. He. He. He. He. He. He. He He. He. He. He. He. He. He.,He He. He. He. He. He. He. He. He. He He. He. He. He. He. He.,He He. He. He. He. He. He. He He. He. He. He. He. He. He. He.
I I I I I I I I I I I I I I I I I I I I I I I I I I I I I I,I I I I I I I I I I I I I I I I I I I I I I I I I I I I I but,I I I I I I I I I I I I I I I I I I I I I I I I I I I I I during,I I I I I I I I I I I I I I I I I I I I I I I I I I I I but I,I I I I I I I I I I I I I I I I I I I I I I I I I I I I I most
adult and adult and adult and adult and adult and adult and adult and adult and adult and adult and adult and adult and adult and adult and adult and,adult and adult and adult and adult and adult and adult and adult adult and adult and adult and adult and adult and adult and adult and adult and adult,adult and adult and adult and adult and adult and adult adult and adult and adult and adult and adult and adult and adult and adult and adult and adult,adult and adult and adult and adult and adult and adult and adult and adult adult and adult and adult and adult and adult and adult and adult and adult,adult and adult and adult and adult and adult adult and adult and adult and adult and adult and adult and adult and adult and adult and adult and adult
",. g. g. g. g. g. g. g. g. g. g. g. g. g. g.",17 g. 17 g. 17 g. 17 g. 17 g. 17 g. 17 g. 17 g. 17 g. 17 g.,ges ges ges ges ges ges ges ges ges ges ges ges ges ges ges g,Hi. Hi. Hi. Hi. Hi. Hi. Hi. Hi. Hi. Hi. Hi. Hi. Hi. Hi. Hi.,17. 17. 17. 17. 17. 17. 17. 17. 17. 17. 17. 17. 17. 17. 17.
take take take take take take take take take take take take take take take take take take take take take take take take take take take take take take,"take take take take take take take take take take take take take take take take take take take take take take take take take take take take take,",take take take take take take take take take take take take take take take take take take take take take take take take take take take take take shower,take take take take take take take take take take take take take take take take take take take take take take take take shower take take take take take,take take take take take take take take take take take take take take take take take take take take take take shower take take take take take take take
-. The character and the character and the character and the character and the character and the character and the character and the character and the character and the,made the character and the character and the character and the character and the character and the character and the character and the character and the character and the character,character as the character and the character as the character and the character as the character and the character as the character and the character as the character and the,-. The character and the character and the character and the character and character and the character and the character and the character and the character and the character,-. The character and the character and the character and the character and the character and character and the character and the character and the character and the character
game in the game in the game in the game in the game in the game in the game in the game in the game in the game in the,game from the game in the game in the game in the game in the game in the game in the game in the game in the game in the,the from the game in the game in the game in the game in the game in the game in the game in the game in the game in the,thus in the game in the game in the game in the game in the game in the game in the game in the game in the game in the,in in the game in the game in the game in the game in the game in the game in the game in the game in the game in the
Jim and Jim and Jim and Jim and Jim and Jim and Jim and Jim and Jim and Jim and Jim and Jim and Jim and Jim and Jim and,the of the seer of the seer of the seer of the seer of the seer of the seer of the seer of,se of the seer of the seer of the seer of the seer of the seer of the seer of the seer of,and of the seer of the seer of the seer of the seer of the seer of the seer of the seer of,for of the seer of the seer of the seer of the seer of the seer of the seer of the seer of
asonry for construction work was completed by 1870 as work was completed by 1870 as work was completed by 1870 as work was completed by 1870 as work was completed,late as late as June for construction work was completed as late as June for construction work was completed as late as June for construction work was completed as late,asonry for construction work was completed by 1870 as work was completed by 1870 as work was completed as work was completed as work was completed as work was completed,June work was completed by late June as work was completed by late June as work was completed by late June as work was completed by late June as work,was work was completed as late as June for construction work was completed as late as June for construction work was completed as late as June for construction work was
between it is with it is with it is with it is with it is with it is with it is with it is with it is with it is,between it is with it is with it is with it is with it is is with it is with it is with it is with it is with it,between it is with it is with it is with it it is with it is with it is with it is with it is with it is with it,between it is with it is with it is with it is with it is with it is is with it is with it is with it is with it,between it is with it is with it is with it is is with it is with it is with it is with it is with it is with it
dime's V. V. V V V V V V V V V V V V V V V V V V V V V V,dime's V. V. V V V V. V V V V V V V V V V V V V V V V V,dime's V. V. V V V V V. V V V V V V V V V V V V V V V V,dime's V. V. V V V V V V. V V V V V V V V V V V V V V V,dime's V. V. V V V V V V V. V V V V V V V V V V V V V V
3 3 3 3 3 3 3 3 3 3 3 3 3 3 3 3 3 3 3 3 3 3 3 3 3 3 3 3 3 3,2 2 2 2 2 2 2 2 2 2 2 2 2 2 2 2 2 2 2 2 2 2 2 2 2 2 2 2 2 2,3 3 3 3 3 3 3 3 3 3 3 3 3 3 3 3 3 3 3 3 3 3 3 3 3 3 3 3 3 2,3 3 2 2 2 2 2 2 2 2 2 2 2 2 2 2 2 2 2 2 2 2 2 2 2 2 2 2 2 2,3 3 3 3 3 3 3 3 3 3 3 3 3 3 3 3 3 3 3 3 3 3 3 3 3 3 3 2 3 3
Do to find and to find and to find and to find and to find and to find and to find and to find and to find and to find,members and cast members and cast members and cast members and cast members and cast members and cast members and cast members and cast members and cast members and cast,.. to find and to find and to find and to find and to find and to find and to find and to find and to find and to,and to find and to find and to find and to find and to find and to find and to find and to find and to find and to find,for to find and to find and to find and to find and to find and to find and to find and to find and to find and to find
La the ou La the ou La the ou La the ou La the ou La the ou La the ou La the,the ou the ou the ou the ou the ou the ou the ou the ou the ou the ou,ou ou ou ou ou ou ou ou ou ou ou ou ou ou ou o,1960 ou the ou the ou the ou the ou the ou the ou the ou the ou the ou,1970 ou the ou the ou the ou the ou the ou the ou the ou the ou the ou
I I. I. I. I. I. I. I. I. I. I. I. I. I. I. I,. I. I. I. I. I. I. I. I. I. I. I. I. I. I. I,I. I. I. I. I. I. I. I. I. I. I. I. I. I. I.,to I. I. I. I. I. I. I. I. I. I. I. I. I. I. I,I I. I. I. I. I. I. I. I I. I. I. I. I. I. I.
I. I. I. I. I. I. I. I. I. I. I. I. I. I. I.,I and I. I. I. I. I. I. I. I. I. I. I. I. I. I.,I. and I. and I. and I. and I. and I. and I. and I. and I. and I. and,Italian and Italian and Italian and Italian and Italian and Italian and Italian and Italian and Italian and Italian and Italian and Italian and Italian and Italian and Italian and,the I. and I. and I. and I. and I. and I. and I. and I. and I. and I.
bird and the bird and the bird and the bird and the bird and the bird and the bird and the bird and the bird and the bird and the,lead for the lead and the lead and the lead and the lead and the lead and the lead and the lead and the lead and the lead and the,its for the lead and the lead and the lead and the lead and the lead and the lead and the lead and the lead and the lead and the,and for the lead and the lead and the lead and the lead and the lead and the lead and the lead and the lead and the lead and the,its and the bird and the bird and the bird and the bird and the bird and the bird and the bird and the bird and the bird and the
Iraq as Iraq became Iraq as Iraq became Iraq as Iraq became Iraq as Iraq became Iraq as Iraq became Iraq as Iraq became Iraq as Iraq became Iraq as,Wars United for United for United for United for United for United for United for United for United for United for United for United for United for United for United,government United for United for United for United for United for United for United for United for United for United for United for United for United for United for United,Army United for United for United for United for United for United for United for United for United for United for United for United for United for United for United,government for government for government for government for government for government for government for government for government for government for government for government for government for government for government for
a Thea Thea Thea Thea Thea Thea Thea Thea Thea Thea Thea Thea Thea Thea The,it Thea Thea Thea Thea Thea Thea Thea Thea Thea Thea Thea Thea Thea Thea The,hi Thea Thea Thea Thea Thea Thea Thea Thea Thea Thea Thea Thea Thea Thea The,a Thea Thea Thea Thea Thea Thea Thea Thea Thea Thea Thea Thea Thea Thea the,the Thea Thea Thea Thea Thea Thea Thea Thea Thea Thea Thea Thea Thea Thea The
p. p. p. p. p. p. p. p. p. p. p. p. p. p. p.,. a. p. p. p. p. p. p. p. p. p. p. p. p. p. p,ch. p. p. p. p. p. p. p. p. p. p. p. p. p. p.,a. p. p. p. p. p. p. p. p. p. p. p. p. p. p.,p. a. p. p. p. p. p. p. p. p. p. p. p. p. p.
H. H. H. H. H. H. H. H. H. H. H. H. H. H. H.,H H. H. H. H. H. H. H. H. H. H. H. H. H. H. H,. H. H. H. H. H. H. H. H. H. H. H. H. H. H. H,Do I Do that I Do that I Do that I Do that I Do that I Do that I Do that I Do that I Do that I Do,. I. I. I. I. I. I. I. I. I. I. I. I. I. I. I
methods and the methods and the methods and the methods and the methods and the methods and the methods and the methods and the methods and the methods and,methods and methods and the methods and the methods and the methods and the methods and the methods and the methods and the methods and the methods and the,methods and the methods and methods and the methods and the methods and the methods and the methods and the methods and the methods and the methods and the,methods and methods and the methods and methods and the methods and the methods and the methods and the methods and the methods and the methods and the methods,methods and the methods and the methods and methods and the methods and the methods and the methods and the methods and the methods and the methods and the
number the number with the number with the number with the number with the number with the number with the number with the number with the number with the number,number the number with the number with the number number with the number with the number with the number with the number with the number with the number with the,number the number with the number the number the number the number the number the number the number the number the number the number the number the number the number,number the number with the number with the number with the number number with the number with the number with the number with the number with the number with the,number the number with the number with the number with the number with the number with the number with the number with the number with the number number with the
average more than twice more than more than more than twice more than more than twice more than twice more than twice more than twice more than twice more than,average more than twice more than more than twice more than more than twice more than twice more than twice more than twice more than twice more than twice more,average more than twice more than more than more than twice more than more than more than twice more than more than twice more than more than twice more than,average more than twice more than more than twice more than more than twice more than more than twice more than twice more than twice more than twice more than,average more than twice more than more than more than twice more than more than twice more than more than twice more than twice more than twice more than twice
I state that the committee that the committee that the committee that the committee that the committee that the committee that the committee that the committee that the committee that,address the state to the state to the state to the state to the state to the state to the state to the state to the state to the state,I state that the committee that the committee that the committee that the committee that the committee that the committee that the committee that the committee that the committee the,I state that the committee that the committee that the committee that the committee that the committee that the committee that the committee that the committee the committee that the,I state that the committee that the committee that the committee that the committee that the committee that the committee that the committee the committee that the committee that the
. I. I. I. I. I. I. I. I. I. I. I. I. I. I. I,I I and I and I and I and I and I and I and I and I and I and I and I and I and I and I,I and I and I and I and I and I and I and I and I and I and I and I and I and I and I and,. I and I and I and I and I and I and I and I and I and I and I and I and I and I and I,and I and I and I and I and I and I and I and I and I and I and I and I and I and I and I
girl's I was the girl's I was the girl's I was the girl's I was the girl I was the girl ',let's'I was the girl's'I was the girl'I was the girl'I was the girl'I was the girl,the I's to the I's to the I's to the I's to the I's to the I's to,let's'I was the girl's girl'I was the girl'I was the girl'I was the girl'I was the,uel's I's to the I's to the I's to the I's to the I's to the I '
It It It It It It It It It It It It It It It It It It It It It It It It It It It It It It,organized financial assistance organized financial assistance organized financial assistance organized financial assistance organized financial assistance organized financial assistance organized financial assistance organized financial assistance organized financial assistance organized financial assistance,It It It It It It It It It It It It It It It It It It It It It It It It It It It It It 1890,It Ita Ita Ita Ita Ita Ita Ita Ita Ita Ita Ita Ita Ita Ita It,It It It It It It It It It It It It It It It It It It It It It It It It It It It It It financial
Over and Over and Over and Over and Over and Over and Over and Over and Over and Over and Over and Over and Over and Over and Over and,technology of technology and technology of technology and technology of technology and technology of technology and technology of technology and technology of technology and technology of technology and technology of,technology of technology and technology of technology of technology of technology of technology of technology of technology of technology of technology of technology of technology of technology of technology of,technology and technology of technology and technology of technology and technology of technology and technology of technology and technology of technology and technology of technology and technology of technology and,technology and technology and technology and technology and technology and technology and technology and technology and technology and technology and technology and technology and technology and technology and technology and
ita a.a. a.a. a.a. a.a. a.a. a.a. a.a. a,ita a.a.a. a.a. a.a. a.a. a.a. a.a. a.a,a a.a. a.a. a.a. a.a. a.a. a.a. a.a. a,ita a.a. a.a. a.a. a.a. a.a. a.a. a.a.a,a. a. a. a. a. a. a. a. a. a. a. a. a. a. a.
Her. Her. Her. Her. Her. Her. Her. Her. Her. Her. Her. Her. Her. Her. Her.,produced. produced. produced. produced. produced. produced. produced. produced. produced. produced. produced. produced. produced. produced. produced.,produced engine produced engine produced engine produced engine produced engine produced engine produced engine produced engine produced engine produced engine produced engine produced engine produced engine produced engine produced engine,Her. Her. Her. Her. Her. Her. Her. Her Her. Her. Her. Her. Her. Her. Her. Her,Her. Her. Her. Her. Her. Her. Her. Her. Her Her. Her. Her. Her. Her. Her. Her
properties properties and properties and properties and properties and properties and properties and properties and properties and properties and properties and properties and properties and properties and properties and properties,gas and gas and gas and gas and gas and gas and gas and gas and gas and gas and gas and gas and gas and gas and gas and,data and more data and more data and more data and more data and more data and more data and more data and more data and more data and more,properties and gas and gas and gas and gas and gas and gas and gas and gas and gas and gas and gas and gas and gas and gas and,ium and mercury and mercury and mercury and mercury and mercury and mercury and mercury and mercury and mercury and mercury and mercury and mercury and mercury and mercury and
features of some features of some features of some features of some features of some features of some features of some features of some features of some features of some,features of some features of some features of some features of some features of some features of some features of some features of some features of some features of features,features of some features of some features of some features of some features of some features of some features of some features of some features of features of some features,features of some features of some features of some features of some features of some features of some features of some features of features of some features of some features,features of some features of some features of some features of some features of some features of some features of features of some features of some features of some features
1998 in 1998 in 1998 in 1998 in 1998 in 1998 in 1998 in 1998 in 1998 in 1998 in 1998 in 1998 in 1998 in 1998 in 1998 in,I in 1998 in 1998 in 1998 in 1998 in 1998 in 1998 in 1998 in 1998 in 1998 in 1998 in 1998 in 1998 in 1998 in 1998 in,in in 1998 in 1998 in 1998 in 1998 in 1998 in 1998 in 1998 in 1998 in 1998 in 1998 in 1998 in 1998 in 1998 in 1998 in,II in 1998 in 1998 in 1998 in 1998 in 1998 in 1998 in 1998 in 1998 in 1998 in 1998 in 1998 in 1998 in 1998 in 1998,Hi Hi Hi Hi HiI HiI HiI HiI HiI HiI HiI HiI HiI HiI HiI HiI HiI
on one on one on one on one on one on one on one on one on one on one on one on one on one on one on one,that one on one on one on one on one on one on one on one on one on one on one on one on one on one on one,. that one on one on one on one on one on one on one on one on one on one on one on one on one on one on,. on that one on that one on that one on that one on that one on that one on that one on that one on that one on that,that one on one on one on that one on that one on that one on that one on that one on that one on that one on that one
