management and management and the management and management and management and management and management and management and management and management and management and management and management and management and management,management and the management and the management and the management and the management and the management and the management and the management and the management and the management and the,management and management and the management and management and management and the management and management and management and management and management and management and management and management and management and,management and management and the management and management and management and management and the management and management and management and management and management and management and management and management and,management and management and the management and management and management and the management and management and management and the management and management and management and the management and management and
mods for mods for mods for mods for mods for mods for mods for mods for mods for mods for mods for mods for mods for mods for mods for,mods for mods of mods of mods of mods of mods of mods of mods of mods of mods of mods of mods of mods of mods of mods of,"mods, mods of mods of mods of mods of mods of mods of mods of mods of mods of mods of mods of mods of mods of mods of","mods, mods for mods for mods for mods for mods for mods for mods for mods for mods for mods for mods for mods for mods for mods for",mods for mods of mods for mods of mods of mods of mods of mods of mods of mods of mods of mods of mods of mods of mods of
It It It It It It It It It It It It It It It It It It It It It It It It It It It It It It,up It It It It It It It It It It It It It It It It It It It It It It It It It It It It It,I It It It It It It It It It It It It It It It It It It It It It It It It It It It It It,mg mg mg mg mg mg mg mg mg mg mg mg mg mg mg mg mg mg mg mg mg mg mg mg mg mg mg mg mg mg,Volume mg mg mg mg mg mg mg mg mg mg mg mg mg mg mg mg mg mg mg mg mg mg mg mg mg mg mg mg mg
please for the times and for the times and for the times and for the times and for the times and for the times and for the times and for,? for the times and for the times and for the times and for the times and for the times and for the times and for the times and for,please for the times and the times and the times and the times and the times and the times and the times and the times and the times and the,the days and the times and the times and the times and the times and the times and the times and the times and the times and the times and,please for the times and for the times and for the times and for the times and for the times and for the times and for the times and the
I I I I I I I I I I I I I I I I I I I I I I I I I I I I I I,give I give you I give you I give you I give you I give you I give you I give you I give you I give you I give,track I track I track I track I track I track I track I track I track I track I track I track I track I track I track I,give I give you I give you you I give you I give you I give you I give you I give you I give you I give you I,give I give you I give you I give you you I give you I give you I give you I give you I give you I give you I
", and the track for the track for the track for the track for the track for the track for the track for the track for the track for the",. and the track for the track for the track for the track for the track for the track for the track for the track for the track for the,k and the track for the track for the track for the track for the track for the track for the track for the track for the track for the,en and the track for the track for the track for the track for the track for the track for the track for the track for the track for the,and and the track for the track for the track for the track for the track for the track for the track for the track for the track for the
Please Please Please Please Please Please Please Please Please Please Please Please Please Please Please Please Please Please Please Please Please Please Please Please Please Please Please Please Please Please,Yeah the schedule for the schedule for the schedule for the schedule for the schedule for the schedule for the schedule for the schedule for the schedule for the schedule,the schedule for the schedule for the schedule for the schedule for the schedule for the schedule for the schedule for the schedule for the schedule for the schedule for,these the schedule for the schedule for the schedule for the schedule for the schedule for the schedule for the schedule for the schedule for the schedule for the schedule,these schedule for the schedule for the schedule for the schedule for the schedule for the schedule for the schedule for the schedule for the schedule for the schedule for
42 ( 2 ) ( 2 ) ( 2 ) ( 2 ) ( 2 ) ( 2 ) ( 2 ) ( 2 ) ( 2 ) ( 2,", ( 2 ) ( 2 ) ( 2 ) ( 2 ) ( 2 ) ( 2 ) ( 2 ) ( 2 ) ( 2 ) ( 2",. ( 2 ) ( 2 ) ( 2 ) ( 2 ) ( 2 ) ( 2 ) ( 2 ) ( 2 ) ( 2 ) ( 2,42 ( 2 ) ( 2 ) ) ( 2 ) ( 2 ) ( 2 ) ( 2 ) ( 2 ) ( 2 ) ( 2 ) (,!!!! ( ) ) ) ) ) ) ) ) ) ) ) ) ) ) ) ) ) ) ) ) ) ) ) ) ) ) ) )
meter you have to have to have to have to have to have to have to have to have to have to have to have to have to have to,", you have to have to have to have to have to have to have to have to have to have to have to have to have to have to",this you have to have to have to have to have to have to have to have to have to have to have to have to have to have to,more you have to have to have to have to have to have to have to have to have to have to have to have to have to have to,have to have this because I have to have this because I have to have this because I have to have this because I have to have this because I
plant of a plant of a plant of a plant of a plant of a plant of a plant of a plant of a plant of a plant of a,han a han han han han han han han han han han han han han han,plant of a plant of a plant of plant of plant of plant of plant of plant of plant of plant of plant of plant of plant of plant of,plant of a plant of a plant of a plant of a plant of a plant of a plant of a plant of a plant of a plant of plant,plant of a plant of a plant of a plant of a plant of a plant of a plant of a plant of a plant of plant of a plant
until last until last until last until last until last until last until last until last until last until last until last until last until last until last until last,until last until last until last until last until last last until last until last until last until last until last until last until last until last until last until,until last until last until last until last until last until last last until last until last until last until last until last until last until last until last until,until last until last until last until last last until last until last until last until last until last until last until last until last until last until last until,until last until last until last until last until last until last until last last until last until last until last until last until last until last until last until
minimum will be minimum will be minimum will be minimum will be minimum will be minimum will be minimum will be minimum will be minimum will be minimum will be,minimum will be minimum will be minimum will be minimum minimum will be minimum will be minimum will be minimum will be minimum will be minimum will be minimum will,minimum will be minimum will be minimum will be minimum will be minimum minimum will be minimum will be minimum will be minimum will be minimum will be minimum will,minimum will be minimum will be minimum will be minimum will be minimum will be minimum minimum will be minimum will be minimum will be minimum will be minimum will,minimum will be minimum will be minimum minimum will be minimum will be minimum will be minimum will be minimum will be minimum will be minimum will be minimum will
I I I I I I I I I I I I I I I I I I I I I I I I I I I I I I,I I I I I I I I I I I I I I I I I I I I I I I I I I I I I would,I I I I I I I I I I I I I I I I I I I I I I I I I I I I I will,I I I I I I I I I I I I I I I I I I I I I I I I I I I I I Do,I I I I I I I I I I I I I I I I I I I I I I I I I I I I I by
I I I I I I I I I I I I I I I I I I I I I I I I I I I I I I,I I I I I I I I I I I I I I I I I I I I I I I I I I I I I ,physical I. I. I. I. I. I. I. I. I. I. I. I. I. I. I,I I. I. I. I. I. I. I. I. I. I. I. I. I. I. I,trade I. I. I. I. I. I. I. I. I. I. I. I. I. I. I
. r. r. r. r. r. r. r. r. r. r. r. r. r. r. r,jan. r. r. r. r. r. r. r. r. r. r. r. r. r. r.,. and r. r. r. r. r. r. r. r. r. r. r. r. r. r.,dec and r. r. r. r. r. r. r. r. r. r. r. r. r. r.,dec. and r. r. r. r. r. r. r. r. r. r. r. r. r. r
transfer to transfer to transfer to transfer to transfer to transfer to transfer to transfer to transfer to transfer to transfer to transfer to transfer to transfer to transfer to,transfer to transfer transfer to transfer to transfer to transfer to transfer to transfer to transfer to transfer to transfer to transfer to transfer to transfer to transfer to transfer,transfer transfer to transfer to transfer to transfer to transfer to transfer to transfer to transfer to transfer to transfer to transfer to transfer to transfer to transfer to transfer,transfer to transfer to transfer to transfer to transfer to transfer to transfer to transfer to transfer to transfer to transfer to transfer to transfer from transfer to transfer to,transfer to transfer to transfer to transfer to transfer to transfer to transfer to transfer to transfer to transfer to transfer to transfer from transfer to transfer to transfer to
the order in the order in the order in the order in the order in the order in the order in the order in the order in the order in,order the order in the order the order the order the order the order the order the order the order the order the order the order the order the order,in the order in the order in the order in the order in the order in the order in the order in the order in the order in the order,in in the order in the order in the order in the order in the order in the order in the order in the order in the order in the,order the order in the order the order in the order the order the order the order the order the order the order the order the order the order the
I I I I I I I I I I I I I I I I I I I I I I I I I I I I I I,I I I I I I I I I I I I I I I I I I I I I I I I I I I I I in,I I I I I I I I I I I I I I I I I I I I I I I I I I I I I The,I I I I I I I I I I I I I I I I I I I I I I I I I I I I I as,I I I I I I I I I I I I I I I I I I I I I I I I I I I I I St
Re Re Re Re re re re re re re re re re re re re re re re re re re re re re re re re re re,Re Re Re Re re Re re re re re re re re re re re re re re re re re re re re re re re re re,Re. Re. re. re. re. re. re. re. re. re. re. re. re. re. re.,. s. and s. s. s. s. s. s. s. s. s. s. s. s. s.,"Re, Re and Re and Re and Re and Re and Re and Re and Re and Re and Re and Re and Re and Re and Re and"
It It It It It It It It It It It It It It It It It It It It It It It It It It It It It It,said It said It said It said It said It said It said It said It said It said It said It said It said It said It said It,En It En En En En En En En En En En En En En En En En En En En En En En En En En En En En,were yesterday were yesterday were yesterday were yesterday were yesterday were yesterday were yesterday were yesterday were yesterday were yesterday were yesterday were yesterday were yesterday were yesterday were yesterday,would It It It It It It It It It It It It It It It It It It It It It It It It It It It It It
m a. m. m. m. m. m. m. m. m. m. m. m. m. m. m,. a. m. m. m. m. m. m. m. m. m. m. m. m. m. m,m. a. m. a. m. a. m. a. m. a. m. a. m. a. m.,m a. m. a. m. a. m. a. m. a. m. a. m. a. m. a,. a. m. a. m. a. m. a. m. a. m. a. m. a. m. a
I I I I I I I I I I I I I I I I I I I I I I I I I I I I I I,Fast Fast Fast Fast Fast Fast Fast Fast Fast Fast Fast Fast Fast Fast Fast Fast Fast Fast Fast Fast Fast Fast Fast Fast Fast Fast Fast Fast Fast Fast,I I. I. I. I. I. I. I. I. I. I. I. I. I. I. I,Fast I. Fast I. Fast I. Fast I. Fast I. Fast I. Fast I. Fast I. Fast I. Fast I.,possibly I. I. I. I. I. I. I. I. I. I. I. I. I. I. I
I I I I I I I I I I I I I I I I I I I I I I I I I I I I I I,I I I I I I I I I I I I I I I I I I I I I I I I I I I I I as,I I I I I I I I I I I I I I I I I I I I I I I I I I I I I u,t tes tes tes tes tes tes tes tes tes tes tes tes tes tes t,I I I I I I I I I I I I I I I I I I I I I I I I I I I I I m
I I I I I I I I I I I I I I I I I I I I I I I I I I I I I I,I I I I I I I I I I I I I I I I I I I I I I I I I I I I I 9,I I I I I I I I I I I I I I I I I I I I I I I I I I I I I at,I I I I I I I I I I I I I I I I I I I I I I I I I I I I I 16,I I I I I I I I I I I I I I I I I I I I I I I I I I I I I were
blocks and blocks of blocks of blocks of blocks of blocks of blocks of blocks of blocks of blocks of blocks of blocks of blocks of blocks of blocks of,blocks and blocks of blocks of blocks and blocks of blocks of blocks of blocks of blocks of blocks of blocks of blocks of blocks of blocks of blocks of,blocks and blocks of blocks of blocks of blocks of blocks of blocks of blocks of blocks of blocks of blocks of blocks of blocks of blocks of blocks and,blocks and blocks of blocks of blocks or blocks of blocks of blocks of blocks of blocks of blocks of blocks of blocks of blocks of blocks of blocks of,blocks and blocks of blocks of blocks of blocks of blocks of blocks of blocks of blocks of blocks of blocks of blocks of blocks of blocks of blocks or
share and share and share and share and share and share and share and share and share and share and share and share and share and share and share and,share and share and share and share and share share and share and share and share and share and share and share and share and share and share and share,share and share and share and share and share and share share and share and share and share and share and share and share and share and share and share,share and share and share and share share and share and share and share and share and share and share and share and share and share and share and share,share and share and share and share and share and share and share share and share and share and share and share and share and share and share and share
5 5 5 5 5 5 5 5 5 5 5 5 5 5 5 5 5 5 5 5 5 5 5 5 5 5 5 5 5 5,I I I I I I I I I I I I I I I I I I I I I I I I I I I I I I,I I. I. I. I. I. I. I. I. I. I. I. I. I. I. I,5 I. 5 I. 5 I. 5 I. 5 I. 5 I. 5 I. 5 I. 5 I. 5 I.,5 I. I. I. I. I. I. I. I. I. I. I. I. I. I. I
I I I I I I I I I I I I I I I I I I I I I I I I I I I I I I,I I I I I I I I I I I I I I I I I I I I I I I I I I I I I ,r ud ud ud ud ud ud ud ud ud ud ud ud ud ud u,ud ud ud ud ud ud ud ud ud ud ud ud ud ud ud u,Pr ud ud ud ud ud ud ud ud ud ud ud ud ud ud u
information is more information is more information is more information is more information is more information is more information is more information is more information is more information is more,information with information related to information related to information related to information related to information related to information related to information related to information related to information related to information,information is more information is more information is information is more information is more information is more information is more information is more information is more information is more information,information is more information is more information is more information is more information is more information is more information is is more information is more information is more information is,information is more information is more information is more information is more information is more information is is more information is more information is more information is more information is
last in last in last in last in last in last in last in last in last in last in last in last in last in last in last in,last in last in last in last in last in last in last in last in last in last in last in last in last in last in last last,last in last in last in last in last in last in last in last in last in last in last in last in last in last last in last,last in last in last in last in last in last in last in last in last in last in last in last in last last in last in last,last in last in last in last in last in last in last in last in last in last in last in last last in last in last in last
Yeah. Yeah. Yeah. Yeah. Yeah. Yeah. Yeah. Yeah. Yeah. Yeah. Yeah. Yeah. Yeah. Yeah. Yeah.,. Yeah. Yeah. Yeah. Yeah. Yeah. Yeah. Yeah. Yeah. Yeah. Yeah. Yeah. Yeah. Yeah. Yeah. Yeah,", Yeah. Yeah. Yeah. Yeah. Yeah. Yeah. Yeah. Yeah. Yeah. Yeah. Yeah. Yeah. Yeah. Yeah. Yeah",I I. I. I. I. I. I. I. I. I. I. I. I. I. I. I,. I. I. I. I. I. I. I. I. I. I. I. I. I. I. I
conference of conference of conference of conference of conference of conference of conference of conference of conference of conference of conference of conference of conference of conference of conference of,conference of conference conference of conference of conference of conference of conference of conference of conference of conference of conference of conference of conference of conference of conference of conference,conference of conference of conference of conference conference of conference of conference of conference of conference of conference of conference of conference of conference of conference of conference of conference,conference of conference of conference of conference of conference conference of conference of conference of conference of conference of conference of conference of conference of conference of conference of conference,conference of conference of conference conference of conference of conference of conference of conference of conference of conference of conference of conference of conference of conference of conference of conference
"k, k. k. k. k. k. k. k. k. k. k. k. k. k. k.",", ky. ky. ky. ky. ky. ky. ky. ky. ky. ky",k ky. ky. ky. ky. ky. ky. ky. ky. ky. ky,"ub, ky. ky. ky. ky. ky. ky. ky. ky. ky. k","k, ky. ky. ky. ky. ky. ky. ky. ky. ky. k"
price of stock of stock of stock of stock of stock of stock of stock of stock of stock of stock of stock of stock of stock of stock of,2000 of stock of stock of stock of stock of stock of stock of stock of stock of stock of stock of stock of stock of stock of stock of,stock of stock of stock of stock of stock of stock of stock of stock of stock of stock of stock of stock of stock of stock of stock of,104 of stock of stock of stock of stock of stock of stock of stock of stock of stock of stock of stock of stock of stock of stock of,90 stock of stock of stock of stock of stock of stock of stock of stock of stock of stock of stock of stock of stock of stock of stock
. a. a. a. a. a. a. a. a. a. a. a. a. a. a. a,company he has a company he has a company he has a company he has a company he has a company he has a company he has a company he,a. a. a. a. a. a. a. a. a. a. a. a. a. a. a.,job a job he has a job he has a job he has a job he has a job he has a job he has a job he has a,. a. a. a. a. a. a. a a. a. a. a. a. a. a. a.
en. en. en. en. en. en. en. en. en. en. en. en. en. en. en.,Ah as Ah as Ah as Ah as Ah as Ah as Ah as Ah as Ah as Ah as Ah as Ah as Ah as Ah as Ah as,. r. r. r. r. r. r. r. r. r. r. r. r. r. r. r,as. en. en. en. en. en. en. en. en. en. en. en. en. en. en.,en. en. en. en. en. en en. en. en. en. en. en. en. en. en. en
. a. m. m. m. m. m. m. m. m. m. m. m. m. m. m,. a. m. a. m. a. m. a. m. a. m. a. m. a. m. a,I that I was that I was that I was that I was that I was that I was that I was that I was that I was that I,. I. I. I. I. I. I. I. I. I. I. I. I. I. I. I,. a. m. a. a. m. a. m. a. m. a. m. a. m. a. m
review and review and review and review and review and review and review and review and review and review and review and review and review and review and review and,"business, and business and business and business and business and business and business and business and business and business and business and business and business and business and business",chief and chief executive officer and chief executive officer and chief executive officer and chief executive officer and chief executive officer and chief executive officer and chief executive officer and,review and review and review and review and review and review review and review and review and review and review and review and review and review and review and review,review and review and review and review and review and review and review and review and review and review and review and review and review and review and review as
but I did and I did and I did and I did and I did and I did and I did and I did and I did and I did,I I and I and I and I and I and I and I and I and I and I and I and I and I and I and I,I and I and I and I and I and I and I and I and I and I and I and I and I and I and I and,deals I and I and I and I and I and I and I and I and I and I and I and I and I and I and I,and I and I and I and I and I and I and I and I and I and I and I and I and I and I and I
"its in his, in his, in his, in his, in his, in his, in his, in his, in his, in his","! in his, in his, in his, in his, in his, in his, in his, in his, in his, in his","ended up in his, in his, in his, in his, in his, in his, in his, in his, in his, in","its in his, in his, in his, in his, in his, in his, in his, in his, in his, in its","its in his, in his, in his, his, in his, in his, in his, in his, in his, in his,"
analysts and analysts and analysts and analysts and analysts and analysts and analysts and analysts and analysts and analysts and analysts and analysts and analysts and analysts and analysts,told to the investors and the investors and the investors and the investors and the investors and the investors and the investors and the investors and the investors and the,investors and investors and the investors and the investors and the investors and the investors and the investors and the investors and the investors and the investors and the,investors and investors and the investors and investors and investors and investors and investors and investors and investors and investors and investors and investors and investors and investors and,investors and investors and the investors and investors and the investors and investors and investors and investors and investors and investors and investors and investors and investors and investors
m. m. m. m. m. m. m. m. m. m. m. m. m. m. m.,m a. m. m. m. m. m. m. m. m. m. m. m. m. m. m,. a. m. m. m. m. m. m. m. m. m. m. m. m. m. m,m. a. m. a. m. a. m. a. m. a. m. a. m. a. m.,m a. m. a. m. a. m. a. m. a. m. a. m. a. m. a
report and report and report and report and report and report and report and report and report and report and report and report and report and report and report and,growing and growing and growing and growing and growing and growing and growing and growing and growing and growing and growing and growing and growing and growing and growing and,news and news of news of news of news of news of news of news of news of news of news of news of news of news of news of,growing and growing and growing and and growing and growing and growing and growing and growing and growing and growing and growing and growing and growing and growing and growing,report and report and report and report and report and report and report and report and report and report and report and report and report and report and report of
j. m. m. m. m. m. m. m. m. m. m. m. m. m. m.,m. m. m. m. m. m. m. m. m. m. m. m. m. m. m.,j. j. j. j. j. j. j. j. j. j. j. j. j. j. j.,j. m. j. m. m. m. m. m. m. m. m. m. m. m. m.,m. to m. m. m. m. m. m. m. m. m. m. m. m. m. m
content of content of content of content of content of content of content of content of content of content of content of content of content of content of content of,issue issue of issue of issue of issue of issue of issue of issue of issue of issue of issue of issue of issue of issue of issue of issue,content of content of content of content content of content of content of content of content of content of content of content of content of content of content of content,content of content of content of content of content of content of content of content of content of content of content of content of content of content of content is,content of content of content of content of content content of content of content of content of content of content of content of content of content of content of content
cn. c. c. c. c. c. c. c. c. c. c. c. c. c. c.,m a. m. m. m. m. m. m. m. m. m. m. m. m. m. m,. a. m. m. m. m. m. m. m. m. m. m. m. m. m. m,m. a. m. a. m. a. m. a. m. a. m. a. m. a. m.,l. a. c. c. c. c. c. c. c. c. c. c. c. c. c.
. c. c. c. c. c. c. c. c. c. c. c. c. c. c. c,c. c. c. c. c. c. c. c. c. c. c. c. c. c. c.,. c. c. c. c. c. c. c. c. c. c. c. c. c c. c.,. c. c. c. c. c. c. c. c. c. c. c c. c. c. c.,. c. c. ( c. c. c. c. c. c. c. c. c. c. c. c.
k. k. k. k. k. k. k. k. k. k. k. k. k. k. k.,k. m. m. m. m. m. m. m. m. m. m. m. m. m. m.,m. m. m. m. m. m. m. m. m. m. m. m. m. m. m.,r. m. m. m. m. m. m. m. m. m. m. m. m. m. m.,r. r. r. r. r. r. r. r. r. r. r. r. r. r. r.
I I I I I I I I I I I I I I I I I I I I I I I I I I I I I I,.. I. I. I. I. I. I. I. I. I. I. I. I. I. I.,",. I. I. I. I. I. I. I. I. I. I. I. I. I. I.",. I. I. I. I. I. I. I. I. I. I. I. I. I. I. I,I I I I I I I I I I I I I I I I I I I I I I I I I I I I I.
